recipe_title;category;subcategory;description;ingredients;directions;num_ingredients;num_steps
"Overnight Breakfast Bake with Ham, Cheese, and Croissants;Breakfast And Brunch;Breakfast Casseroles;This overnight breakfast casserole is just the right size for smaller families. We love this with cherry tomatoes, but it is equally nice with fruit. You could also call this a savory bread pudding and serve it for lunch, with a salad. If you love mustard, double the Dijon amount in the recipe.;""[""""butter-flavored cooking spray"""", """"2 large croissants"""", """"\u00bd cup shredded Gruyere cheese"""", """"1 cup diced cooked ham"""", """"6 large eggs"""", """"\u00be cup milk"""", """"\u00bd cup sour cream"""", """"\u00bc teaspoon salt"""", """"\u00bc teaspoon freshly ground black pepper"""", """"1 tablespoon Dijon mustard"""", """"2 tablespoons chopped green onions (Optional)""""]"";""[""""Spray an 8x8-inch baking pan with cooking spray."""", """"Cut croissants into 1 inch cubes (about 4 cups, loosely packed) and spread out on the bottom of the prepared pan. Sprinkle evenly with cheese and ham."""", """"Combine eggs, milk, sour cream, Dijon mustard, salt, and pepper in a bowl. Beat the mixture until well blended using a wire whisk or an egg beater."""", """"Pour egg mixture evenly over the top of the croissants, cheese, and ham."""", """"Cover tightly with aluminum foil and place in the refrigerator for 8 hours."""", """"When ready to bake, set the dish out of the refrigerator on the counter, Preheat the oven to 350 degrees F (175 degrees C)."""", """"Uncover casserole, place in the center of the preheated oven, and bake until the casserole is set, and a knife inserted into the middle of the casserole comes out clean, 45 to 55 minutes."""", """"Cut into serving pieces and garnish with chopped green onions.""""]"";11;8"
"Caprese Quiche;Breakfast And Brunch;Breakfast Quiche;This delicious Italian-style caprese quiche is flavored with mozzarella cheese, tomatoes, and fresh basil. It's simple to make and great for breakfast or lunch!;""[""""1 (9 inch) refrigerated pie crust"""", """"2 tablespoons olive oil"""", """"\u00bc cup diced onion"""", """"8 large eggs"""", """"\u00bc teaspoon lemon juice"""", """"10 leaves chopped fresh basil"""", """"\u00bc teaspoon salt"""", """"1 pinch ground black pepper"""", """"2 tomatoes, diced"""", """"1 (12 ounce) package fresh mozzarella cheese""""]"";""[""""Preheat the oven to 350 degrees F (175 degrees C). Place pie crust in a pie pan or baking dish."""", """"Heat olive oil in a skillet over medium heat. Cook and stir onion until softened and translucent, about 5 minutes. Reduce heat to medium-low, and continue cooking and stirring until onion is very tender and dark brown, 15 to 20 minutes more."""", """"Spread mozzarella cheese and tomatoes over the bottom of pie crust. Whisk eggs, lemon juice, basil, salt, black pepper, and caramelized onion in a large bowl; pour mixture over cheese and tomatoes."""", """"Bake in the preheated oven until eggs are set and crust is flaky, 30 to 40 minutes.""""]"";10;4"
"Air Fryer Sausage Patties;Breakfast And Brunch;Breakfast Sausage;These air fryer sausage patties will be nicely browned. The best part is — you will avoid grease splatter all over your stovetop!;""[""""1 (12 ounce) package sausage patties (such as Johnsonville\u00ae)"""", """"1 serving nonstick cooking spray""""]"";""[""""Grab your ingredients, and preheat an air fryer to 400 degrees F (200 degrees C). Lightly grease the inside of the air fryer basket with nonstick spray."""", """"Arrange sausage patties in a single layer in the air fryer basket."""", """"Cook in the preheated air fryer for 5 minutes; flip the patties and cook about 3 minutes more. An instant-read thermometer inserted into the center of a patty should read at least 160 degrees F (70 degrees C)."""", """"Serve hot and enjoy!""""]"";2;4"
"French Egg and Bacon Sandwich;Breakfast And Brunch;Breakfast Bacon;French Toast with egg and bacon in the center with maple syrup on top. Sprinkle with powdered sugar if desired.;""[""""2 eggs, beaten"""", """"4 slices bread"""", """"4 slices bacon"""", """"2 eggs"""", """"\u00bd cup maple syrup""""]"";""[""""Dip bread slices in beaten eggs. Heat a lightly oiled griddle or frying pan over medium high heat. Cook until browned on both sides. Set aside but keep warm."""", """"Place bacon in a large, deep skillet. Cook over medium high heat until evenly brown. Drain and set aside. Reserve 1 tablespoon of bacon grease in pan and fry remaining two eggs."""", """"Place one piece of French toast on each of two plates. Place the fried eggs on top of the bread, top the eggs with strips of bacon. Cover with the remaining pieces of French toast. Following that by pouring on the syrup.""""]"";5;3"
"Loaf Pan Frittata;Breakfast And Brunch;Breakfast And Brunch;This loaf pan frittata is a great alternative method for making frittata, plus it's easier. Use any type of greens you like, bell peppers, and potatoes, or whatever vegetables you have on hand. My favorite way to serve it is on plain toast with a garlic aioli or lemon mayonnaise, and a small green salad on the side.;""[""""1/4 cup olive oil, divided"""", """"10 ounces baby spinach"""", """"12 large eggs"""", """"1 1/2 teaspoons kosher salt"""", """"1/2 teaspoon ground black pepper"""", """"1 pinch cayenne pepper"""", """"1/2 cup onion"""", """"1 large red bell pepper"""", """"1 1/2 cups cooked potatoes"""", """"4 ounces mild Cheddar or fontina cheese, shredded""""]"";""[""""Preheat the oven to 350 degrees F (180 degrees C). Grease a 9x5-inch loaf pan and line with parchment."""", """"Add 1 tablespoon olive oil to a large skillet over medium-high heat. Add spinach and cook, stirring, until just barely wilted, 1 to 2 minutes. Place a strainer over a bowl; transfer in spinach and let cool. When cool enough to handle, squeeze out all excess water, and set aside."""", """"Crack eggs into a bowl; whisk with salt, black pepper, and cayenne until egg whites disappear. Refrigerate until needed."""", """"Add remaining olive oil to the same skillet and place over medium-high heat. Add shallots, red pepper, and a big pinch of salt; cook, stirring, until peppers are nearly tender, about 4 minutes. Reduce heat to medium if vegetables are browning before getting tender."""", """"Add potatoes, season to taste with salt, and, and cook, stirring, until potatoes are heated through and vegetables are tender, a few minutes more."""", """"Add spinach and egg mixture, and cook, stirring, until a very soft scramble is formed. Turn off the heat and stir in cheese. Pour into the prepared pan. Tap the pan on the counter a few times to settle the contents down."""", """"Bake in the preheated oven until a bamboo skewer inserted near the center comes out clean, 20 to 25 minutes. Cooking time will vary depending on how much or which vegetables you use in the frittata."""", """"Let frittata cool for about 10 minutes, then remove from the pan. Frittata can be served hot, warm, at room temperature, or cold.""""]"";10;8"
"Spinach Feta Egg Wrap;Breakfast And Brunch;Breakfast Burritos;This spinach feta wrap is my knock-off of a wrap at a popular coffee shop in my neighborhood. To make it healthier, use just egg whites and low-fat feta cheese.;""[""""1 large whole-wheat tortilla"""", """"1 \u00bd teaspoons coconut oil"""", """"1 cup chopped baby spinach leaves"""", """"1 oil-packed sun-dried tomato, chopped"""", """"2 eggs, beaten"""", """"\u2153 cup feta cheese"""", """"1 tomato, diced""""]"";""[""""Warm tortilla in a large skillet over medium heat."""", """"Melt coconut oil in a separate skillet over medium-high heat. Saut\u00e9 spinach and tomato in hot oil until spinach wilts, about 1 minute. Add eggs and scramble until almost set, about 2 minutes. Sprinkle feta cheese over eggs and continue cooking until cheese melts, about 1 minute more."""", """"Transfer scrambled egg mixture to warm tortilla in the large skillet; top with diced tomato. Roll tortilla and leave in skillet long enough for wrap to hold its shape, about 30 seconds.""""]"";7;3"
"Easy Acai Smoothie Bowl;Breakfast And Brunch;Breakfast Bowls;This acai smoothie bowl is a delicious breakfast. My kids like it, so I sweeten it with honey, but you can also use agave for a vegan version or not sweeten it at all. Top the smoothie bowls with some granola for crunch, nuts, or other berries of your choosing.;""[""""7 ounces frozen unsweetened acai pulp, partially defrosted in refrigerator overnight"""", """"2 medium ripe frozen bananas"""", """"1 cup blueberries"""", """"\u00be cup almond milk, or more as needed"""", """"2 teaspoons honey, or to taste""""]"";""[""""Combine acai, bananas, blueberries, almond milk, and honey in a blender. Blend until smooth. Smoothie should have a thick consistency, like frozen yogurt."""", """"Pour into 2 bowls and top with banana slices, blueberries, pomegranate seeds, and coconut.""""]"";5;2"
"German Potato Pancakes;Breakfast And Brunch;Breakfast Potatoes;These German potato pancakes are a nice change from regular pancakes. They make a great dinner meal when served with Bratwurst sausage. I spread mine with cranberry sauce and top with maple syrup.;""[""""2 large eggs"""", """"2 tablespoons all-purpose flour"""", """"\u00bc teaspoon baking powder"""", """"\u00bd teaspoon salt"""", """"\u00bc teaspoon pepper"""", """"6 medium potatoes, peeled and shredded"""", """"\u00bd cup finely chopped onion"""", """"\u00bc cup vegetable oil""""]"";""[""""Gather all ingredients."""", """"Beat eggs, flour, baking powder, salt, and pepper together in a large bowl; stir in potatoes and onion."""", """"Heat oil in a large skillet over medium heat. Drop heaping tablespoonfuls of potato mixture into hot oil in batches. Press to flatten."""", """"Cook until browned and crisp, about 3 minutes on each side."""", """"Transfer to a paper towel-lined plate to drain."""", """"Repeat with remaining potato mixture. Enjoy!""""]"";8;6"
"Deluxe Corned Beef Hash;Breakfast And Brunch;Breakfast Meat And Seafood;This corned beef hash is a great way to use up leftover St. Paddy's Day corned beef. I purposely cook a whole corned beef just to make this hash! I throw the carrot in for color, claiming it's the leprechaun's gold. Serve with an egg on top.;""[""""2 tablespoons butter"""", """"2 tablespoons extra-virgin olive oil"""", """"1 large onion, chopped"""", """"5 large Yukon Gold potatoes, peeled and cut into \u00bc-inch cubes"""", """"1 large carrot, coarsely shredded"""", """"2 pounds cooked corned beef, cubed"""", """"2 tablespoons chopped fresh parsley"""", """"\u00bd teaspoon ground black pepper, or to taste"""", """"\u00bc teaspoon dried thyme leaves"""", """"1 pinch salt to taste""""]"";""[""""Gather all ingredients."""", """"Melt butter with olive oil in a large skillet over medium heat. Cook and stir onion until lightly browned, about 8 minutes."""", """"Stir in potatoes and carrot; cook, stirring occasionally, until tender, about 15 minutes."""", """"Stir in corned beef, parsley, pepper, thyme, and salt. Cook, stirring often, until hash is crisp and browned, 10 to 15 more minutes."""", """"Serve and enjoy!""""]"";10;5"
"High-Protein Quinoa Breakfast Bowl;Breakfast And Brunch;Breakfast Bowls;This is my new favorite breakfast and snack, easy to prepare when I need to stop those sweet cravings and have a good source of protein. Great breakfast for my husband who has gout.;""[""""\u00bd cup water"""", """"\u00bc cup multi-colored quinoa"""", """"\u00bd cup reduced-sodium cottage cheese"""", """"\u00bd banana, sliced"""", """"1 tablespoon fresh blueberries"""", """"1 teaspoon chia seeds"""", """"1 pinch ground cinnamon""""]"";""[""""Bring water and quinoa to a boil in a saucepan. Reduce heat to medium-low, cover, and simmer until quinoa is tender, 15 to 20 minutes. Let cool briefly."""", """"Combine 1/2 cup quinoa and cottage cheese in a bowl. Accessorize with banana, blueberries, chia seeds, and cinnamon. Mix up and serve.""""]"";7;2"
"Best Breakfast Casserole (Hash Browns & Eggs);Breakfast And Brunch;Breakfast Potatoes;This breakfast casserole with hash browns is my family's recipe that has been handed down through the years. We've always used the maple-flavored pork sausage but any kind is good. This casserole is a nice and cozy breakfast or brunch meal that everyone will enjoy. It's got the perfect taste with lots of cheese. Yum! Be sure to use a baking dish that is deep enough to cover with aluminum foil.;""[""""1 (2 pound) package frozen hash brown potatoes, thawed"""", """"1 pound pork sausage"""", """"1 small onion, diced"""", """"5 large eggs"""", """"\u00bd cup milk"""", """"\u00bd teaspoon onion powder"""", """"\u215b teaspoon garlic powder"""", """"salt and ground black pepper to taste"""", """"12 ounces shredded Cheddar cheese""""]"";""[""""Gather all ingredients."""", """"Preheat the oven to 350 degrees F (175 degrees C). Grease an 8-inch square pan; add hash brown potatoes and arrange in an even layer."""", """"Place sausage and onion in a large skillet over medium heat. Cook and stir until the sausage is browned and crumbled, about 10 minutes; drain."""", """"Meanwhile, whisk eggs, milk, onion powder, garlic powder, salt, and pepper together in a large bowl until well combined."""", """"Pour over the potatoes and sprinkle with 1/2 of the Cheddar cheese."""", """"Add sausage mixture on top and sprinkle with remaining Cheddar. Cover with aluminum foil."""", """"Bake in the preheated oven for 1 hour. Remove foil; return casserole to the oven and bake until a knife inserted into the center comes out clean, about 10 minutes."""", """"Let stand for 5 minutes before serving.""""]"";9;8"
"Cheesy Amish Breakfast Casserole;Breakfast And Brunch;Breakfast Casseroles;This Amish breakfast casserole has bacon, onion, eggs, hash browns, and lots of cheese. My family loves this hearty dish! Try breakfast sausage in place of bacon if you prefer.;""[""""1 pound sliced bacon, diced"""", """"1 medium sweet onion, chopped"""", """"9 large eggs, lightly beaten"""", """"4 cups frozen shredded hash brown potatoes, thawed"""", """"2 cups shredded Cheddar cheese"""", """"1 \u00bd cups small curd cottage cheese"""", """"1 \u00bc cups shredded Swiss cheese""""]"";""[""""Gather all ingredients. Preheat the oven to 350 degrees F (175 degrees C). Grease a 9x13-inch baking dish."""", """"Heat a large skillet over medium-high heat; cook and stir bacon and onion until bacon is evenly browned, about 10 minutes. Drain."""", """"Transfer bacon and onion to a large bowl. Stir in eggs, potatoes, Cheddar cheese, cottage cheese, and Swiss cheese."""", """"Pour mixture into the prepared baking dish."""", """"Bake in the preheated oven until eggs are set and cheese is melted, 45 to 50 minutes. Let stand 10 minutes before cutting and serving.""""]"";7;5"
"Sheet Pan Breakfast Pizza;Breakfast And Brunch;Breakfast And Brunch;Pop open crescent roll dough and whisk together eggs for a low-effort cheesy breakfast pizza topped with hash browns and Canadian-style bacon.;""[""""cooking spray"""", """"2 (8-ounce) packages crescent dough sheets or refrigerated crescent rolls"""", """"12 ounces bacon, quartered"""", """"1 1/2 cups hash brown potatoes, thawed"""", """"2 cups shredded Cheddar cheese, divided"""", """"12 large eggs"""", """"1/3 cup milk"""", """"1/2 teaspoon salt"""", """"1/8 teaspoon black pepper, plus more for garnish"""", """"chopped fresh chives and/or green onion, for garnish"""", """"flaky salt, for garnish"""", """"hot sauce, for serving""""]"";""[""""Preheat the oven to 375 degrees F (190 degrees C). Coat a 11x17-inch rimmed sheet pan with cooking spray."""", """"Place crescent dough sheets on the prepared sheet pan. Press seams together to seal, stretching slightly if needed to fit the pan. (If using crescent roll dough, press seams of triangles together.) Pinch dough so it comes up the sides of the pan."""", """"Evenly sprinkle Canadian bacon over the dough. Spread hash browns over Canadian bacon and sprinkle with 1 1/2 cups cheese."""", """"Whisk together eggs, milk, table salt, and pepper in a bowl until smooth. Pour evenly over mixture in the sheet pan. Sprinkle with remaining 1/2 cup Cheddar cheese."""", """"Bake until eggs are set and crust is lightly browned, 30 to 35 minutes. Garnish with chives, green onion, flaky salt, and/or additional pepper. Serve with hot sauce.""""]"";12;5"
"Shrimp and Scallop Crepes;Breakfast And Brunch;Crepes And Blintzes;These shrimp and scallop crepes are a seafood lover's dream and will make the taste buds happy. Garnish with more sliced green onion if desired.;""[""""2 cups milk"""", """"1 cup all-purpose flour"""", """"3 large eggs"""", """"4 tablespoons melted butter, divided""""]"";""[""""Combine milk, flour, eggs, and melted butter in a blender. Process until smooth, for at least 1 minute. Set aside and let rest for 30 minutes."""", """"Coat a crepe pan or nonstick small skillet with melted butter. Pour in 1/4 cup crepe batter and swirl the pan until entire bottom is covered in a thin layer of batter. Cook until small brown spots appear on the bottom of the crepe, 1 to 2 minutes."""", """"Loosen crepe carefully from the pan using a spatula and gently flip to brown the other side, 1 to 2 minutes more. Slide crepe onto a plate. Repeat with remaining batter, re-buttering the pan as needed and stacking crepes onto the plate."""", """"Melt 1 tablespoon butter in a skillet over medium heat. Add shrimp and scallops and cook until shrimp are bright pink on the outside and scallops are golden, 2 to 3 minutes. Remove from skillet."""", """"Melt 1 teaspoon butter in the same skillet and increase heat to medium-high. Add mushrooms and green onions; saute until mushrooms are tender, 3 to 4 minutes. Remove from heat."""", """"Melt 4 tablespoons butter in a saucepan over medium heat until bubbling. Whisk in flour until mixture becomes paste-like and lightly golden, about 2 minutes. Add milk and chicken broth and whisk until sauce is smooth and thickened. Thin out with more milk if needed."""", """"Add Swiss cheese, wine, and sherry to the sauce; stir until cheese melts. Season with salt and pepper. Reserve 2/3 cup sauce. Add shrimp, scallops, mushrooms, and onions to the remaining 1/3 of the sauce and stir until heated through."""", """"Spoon about 1/4 cup of the filling across the lower third of each crepe. Roll crepes up jellyroll-style and serve at the table with the reserved sauce.""""]"";4;8"
"Bacon Breakfast Casserole (Gluten Free);Breakfast And Brunch;Breakfast Bacon;""This gluten-free breakfast casserole is a simple recipe that's easy to make. Really nice when you have company over in the morning. Get it ready, pop it in the oven and you have time to socialize while it's cooking! I cut this recipe in half, place it on a pie plate, and bake uncovered for 45 minutes for breakfast for a smaller family; it tastes very much like a crustless quiche and my husband loves it! That is how it is shown in the picture."";""[""""1 pound bacon"""", """"2 cups milk"""", """"8 eggs"""", """"1 teaspoon seasoned salt"""", """"1 teaspoon ground black pepper"""", """"2 cups shredded Cheddar cheese"""", """"1 onion, chopped"""", """"1 green bell pepper, chopped"""", """"3 red potatoes, thinly sliced"""", """"5 mushrooms, sliced""""]"";""[""""Place bacon in a large skillet and cook over medium-high heat, turning occasionally, until evenly browned, about 10 minutes. Drain bacon slices on paper towels, reserving 1 tablespoon bacon grease. Crumble bacon into pieces."""", """"Preheat the oven to 350 degrees F (175 degrees C). Grease a 9x13-inch casserole dish with reserved bacon grease."""", """"Place milk, eggs, seasoned salt, and black pepper in the bowl of a stand mixer fitted with a paddle attachment. Beat on medium speed until smooth and pale, about 5 minutes. Add bacon pieces, Cheddar cheese, onion, and green bell pepper; beat until combined, about 1 1/2 minutes more."""", """"Layer potato slices in the bottom of the casserole dish; pour egg mixture over potatoes and arrange sliced mushrooms on top. Cover casserole with aluminum foil."""", """"Bake in the preheated oven, about 35 minutes. Remove aluminum foil and bake until eggs are set, about 30 minutes more.""""]"";10;5"
"Spinach Quiche with Cottage Cheese;Breakfast And Brunch;Breakfast Quiche;I don't normally like cooked spinach but I fell in love with this at first bite. Sooo good!;""[""""1 (10 ounce) package frozen chopped spinach, thawed"""", """"1 bunch green onions, finely chopped (white parts only)"""", """"4 eggs, beaten"""", """"1 (16 ounce) package cottage cheese"""", """"2 cups shredded Cheddar cheese"""", """"\u00bc cup crushed croutons""""]"";""[""""Preheat oven to 325 degrees F (165 degrees C). Lightly grease a 9 inch pie or quiche pan."""", """"Place spinach in a small saucepan. Cook over medium heat, stirring occasionally until soft. Drain off any remaining liquid. Stir in green onions, eggs, cottage cheese and Cheddar cheese. Pour mixture into prepared pan."""", """"Bake uncovered in preheated oven for 45 minutes. Remove from oven and sprinkle with crushed croutons. Return to oven and bake for an additional 15 minutes, until eggs are set.""""]"";6;3"
"Easy Pancakes;Breakfast And Brunch;Pancakes;This easy pancake recipe doesn't require much thought early in the morning and the pancakes taste great!;""[""""1 cup all-purpose flour"""", """"2 tablespoons white sugar"""", """"2 teaspoons baking powder"""", """"\u00bd teaspoon salt, or to taste"""", """"1 cup milk"""", """"2 tablespoons vegetable oil"""", """"1 large egg, beaten""""]"";""[""""Gather the ingredients."""", """"Combine flour, sugar, baking powder, and salt in a large bowl. Make a well in the center, and pour in milk, oil, and egg. Mix until smooth."""", """"Heat a lightly oiled griddle or frying pan over medium-high heat. Pour or scoop batter onto the griddle, using approximately 1/4 cup for each pancake; cook until bubbles form and the edges are dry, 1 to 2 minutes. Flip and cook until browned on the other side. Repeat with remaining batter."""", """"Serve hot and enjoy!""""]"";7;4"
"Peppery Sausage Breakfast Gravy;Breakfast And Brunch;Southern Breakfast And Brunch;Tasty and easy to make, this gravy is perfect for an early morning breakfast. Gravy will thicken as it sits.;""[""""1 (16 ounce) package sage pork sausage (such as Jimmy Dean\u00ae)"""", """"2 tablespoons salted butter"""", """"3 tablespoons all-purpose flour, or more as needed"""", """"2 cups milk, or more to taste"""", """"ground black pepper to taste""""]"";""[""""Heat a large skillet over medium heat. Cook and stir sausage in the hot skillet until browned and crumbly, 8 to 10 minutes. Add butter and stir until melted."""", """"Add flour; stir until absorbed by the mixture. Add milk and pepper. Increase heat and stir until heated through and thick, about 5 minutes.""""]"";5;2"
"Onion Quiche;Breakfast And Brunch;Breakfast Quiche;This simple quiche is a versatile dish that can be served with almost anything.;""[""""1 tablespoon butter"""", """"1 large onion, diced"""", """"3 eggs"""", """"\u2153 cup heavy cream"""", """"\u2153 cup shredded Swiss cheese"""", """"1 (9 inch) unbaked pie crust""""]"";""[""""Preheat oven to 375 degrees F (190 degrees C)."""", """"Over medium-low heat melt butter in a large saucepan. Add onions and cook slowly, stirring occasionally, until onions are soft."""", """"In a small bowl, beat together eggs and cream. Stir in cheese. Spread onions in bottom of pastry shell. Pour egg mixture over onions."""", """"Bake in preheated oven for 30 minutes, or until eggs have set.""""]"";6;4"
"Low-Carb Savory Breakfast Crepes;Breakfast And Brunch;Crepes And Blintzes;What a delicious way to fix eggs for every day or for company! I load them with good-for-you veggies, too. Feel free to add ham or bacon to the egg mixture. You could also add other favorite low-carb veggies like zucchini or yellow squash. I have a light appetite and use this recipe for two people. That saves two more crepes for another day to use for a different breakfast, or to use for dessert with berries and cream after dinner.;""[""""2 ounces cream cheese, softened"""", """"2 eggs"""", """"\u2153 cup almond flour"""", """"1 tablespoon almond milk""""]"";""[""""Combine cream cheese, eggs, almond flour, and almond milk in a blender. Blend until smooth, 30 seconds to 1 minute."""", """"Heat an 8-inch nonstick skillet over medium heat for about 2 minutes. Pour in 3 tablespoons of crepe batter and swirl until it covers the bottom of the skillet. Cook until lightly browned, about 1 minute per side. Transfer to a plate to cool and cover with parchment paper or a paper towel. Repeat until you have cooked 4 crepes."""", """"Cook pepper and onion in the same skillet until onions are translucent, about 3 minutes. Add spinach and mushrooms and cook until spinach is slightly wilted, 2 to 3 minutes. Add eggs; season with salt and pepper. Scramble until eggs reach desired consistency, about 2 minutes. Top with Cheddar cheese."""", """"To assemble the crepe: Place scrambled egg mixture down the center of 2 crepes and fold over from each side. Reserve remaining crepes for later use.""""]"";4;4"
