recipe_title;category;subcategory;description;ingredients;directions;num_ingredients;num_steps
"Yeast Waffles;Breakfast And Brunch;Waffles;This is a traditional yeast waffle recipe. It makes tasty, crunchy waffles. They are very good with syrup, or my personal favorite is waffles topped with whipped cream and fresh strawberries!;""[""""2 cups milk"""", """"1 (.25 ounce) package active dry yeast"""", """"\u00bd cup warm water (110 degrees F/45 degrees C)"""", """"\u00bd cup butter, melted"""", """"1 teaspoon salt"""", """"1 teaspoon white sugar"""", """"3 cups sifted unbleached all-purpose flour"""", """"2 eggs, slightly beaten"""", """"\u00bd teaspoon baking soda""""]"";""[""""Warm milk in a small saucepan until it bubbles, then remove from heat."""", """"Dissolve yeast in warm water in a small bowl. Let stand until creamy, about 10 minutes."""", """"Combine milk, yeast mixture, butter, salt, sugar, and flour in a large bowl. Mix thoroughly with an electric mixer until batter is smooth. Cover and let stand at room temperature overnight."""", """"The next morning, preheat a waffle iron."""", """"Stir beaten eggs and baking soda into batter; beat well."""", """"Spray the hot waffle iron with nonstick cooking spray. Pour mix onto waffle iron and cook until golden brown.""""]"";9;6"
"Slow Cooker Cheesy Hash Brown Potatoes;Breakfast And Brunch;Breakfast Potatoes;This cheesy crockpot hash brown casserole is a quick and easy recipe, great for potlucks and game-day parties. I use a slow cooker liner for easy cleanup. Be creative and use different types of cheese or even hash browns for more of a kick.;""[""""1 (30 ounce) package frozen shredded hash brown potatoes"""", """"\u00bd cup butter, melted"""", """"2 (10.5 ounce) cans condensed cream of chicken soup"""", """"\u00be cup sour cream"""", """"2 cups shredded Cheddar cheese""""]"";""[""""Place frozen hash browns in a slow cooker. Pour melted butter over hash browns. Pour in condensed soup and sour cream, stirring between each addition. Add Cheddar cheese."""", """"Cook on Low for 4 to 5 hours. Stir mixture after 2 hours of cooking.""""]"";5;2"
"Jamaican Fried Dumplings;Breakfast And Brunch;Breakfast Bread;These fried dumplings are usually served with codfish in Jamaica as part of a big weekend breakfast.;""[""""4 cups all-purpose flour"""", """"2 teaspoons baking powder"""", """"1 \u00bd teaspoons salt"""", """"\u00bd cup butter, cut into cubes and softened"""", """"\u00bd cup cold water"""", """"1 cup vegetable oil for frying""""]"";""[""""Gather all ingredients."""", """"Mix flour, baking powder, and salt together in a large bowl."""", """"Rub in butter until the mixture is crumbly."""", """"Mix in water, 1 tablespoon at a time, to form a firm dough; knead briefly."""", """"Heat oil in a large heavy skillet over medium heat. Break off pieces of dough and shape them into biscuit-like patties."""", """"Place just enough of the dumplings into the hot oil so they are not crowded; fry until golden brown, about 3 minutes per side."""", """"Remove from the pan and drain on paper towels before serving.""""]"";6;7"
"Gluten-Free Buckwheat Crepes;Breakfast And Brunch;Crepes And Blintzes;Crepes that can be eaten by those intolerant to gluten. These can be used for either sweet or savory fillings. They can be made ahead of time and reheated when necessary. The batter will stay in the refrigerator up to 24 hours if kept in an airtight container.;""[""""1 cup milk"""", """"2 eggs"""", """"1 tablespoon vegetable oil"""", """"\u00bd cup gluten-free all-purpose baking flour"""", """"3 tablespoons buckwheat flour"""", """"1 teaspoon butter, or as needed""""]"";""[""""Whisk milk, eggs, and vegetable oil together in a bowl. Sift in all-purpose flour and buckwheat flour gradually, stirring constantly, until batter is quite runny."""", """"Melt butter in an 8-inch skillet or crepe pan over medium heat. Pour 1/4 cup batter into the skillet. Rotate the skillet until batter coats the bottom in a thin layer. Cook until the top of the crepe is no longer wet and the bottom has turned light brown, 1 to 2 minutes. Run a spatula around the edge of the skillet to loosen crepe; flip crepe and cook until the other side has turned light brown, about 1 minute more. Transfer to a cooling rack. Repeat with the remaining batter, whisking gently before using.""""]"";6;2"
"Easy French Toast;Breakfast And Brunch;French Toast;A real treat for Sunday brunch! We garnish the toast with a light sprinkle of confectioners' sugar and serve it with maple syrup. For a special treat you can substitute Amaretto for the vanilla.;""[""""1 egg"""", """"\u00be cup milk"""", """"1 tablespoon ground cinnamon"""", """"1 teaspoon vanilla extract"""", """"1 pinch salt"""", """"2 slices bread""""]"";""[""""Beat together egg, milk, cinnamon, vanilla and salt."""", """"Heat a lightly oiled skillet or griddle over medium heat."""", """"Soak bread slices in egg mixture for 20 second on each side, or until thoroughly coated. Cook bread until both sides are lightly browned and crisp. Serve hot.""""]"";6;3"
"Simple Scones;Breakfast And Brunch;Breakfast Bread;Delicious tender scones with juicy raisins. This sweet scone recipe is easy to make with simple baking ingredients, butter, and sour cream. Perfect for a holiday breakfast, brunch, or afternoon treat with a cup of tea!;""[""""2 cups all-purpose flour"""", """"\u2153 cup sugar"""", """"1 teaspoon baking powder"""", """"\u00bd teaspoon salt"""", """"\u00bc teaspoon baking soda"""", """"8 tablespoons unsalted butter, frozen"""", """"\u00bd cup raisins or dried currants"""", """"\u00bd cup sour cream"""", """"1 large egg"""", """"1 teaspoon white sugar""""]"";""[""""Gather all ingredients."""", """"Preheat the oven to 400 degrees F (200 degrees C); adjust the oven rack to the lower-middle position. Line a baking tray with parchment paper."""", """"Mix flour, 1/3 cup sugar, baking powder, salt, and baking soda in a medium bowl. Grate butter into flour mixture on the large holes of a box grater. Use your fingers to work in butter until mixture resembles coarse crumbs, then toss in raisins."""", """"Whisk sour cream and egg together in a small bowl until combined."""", """"Stir sour cream mixture into flour mixture using a fork until large dough clumps form. Use your hands to shape dough into a ball. (Dough may seem dry at first but will come together as you work it.)"""", """"Place dough on a lightly floured surface and pat into a 7 to 8-inch circle, about 3/4-inch thick. Sprinkle with remaining 1 teaspoon of sugar."""", """"Use a sharp knife to cut into 8 equal triangles; place on the prepared baking tray, about 1-inch apart."""", """"Bake scones in the preheated oven until golden, about 15 to 17 minutes. Cool for 5 minutes; serve warm or at room temperature."""", """"Serve and enjoy!""""]"";10;9"
"Suzanne's Spinach Quiche;Breakfast And Brunch;Breakfast Quiche;Suzanne's spinach quiche is a great vegetarian recipe that can be served for any meal. It's one of my dad's favorites!;""[""""1 (9 inch) unbaked pie crust"""", """"1 (10 ounce) package frozen chopped spinach"""", """"1 cup plain yogurt"""", """"2 eggs"""", """"1 tablespoon all-purpose flour"""", """"\u00bc teaspoon ground black pepper"""", """"4 \u00bd ounces fresh mushrooms, thinly sliced"""", """"4 ounces shredded Cheddar cheese"""", """"\u00bc cup chopped green onions""""]"";""[""""Preheat the oven to 425 degrees F (220 degrees C). Prick pie crust all over with a fork."""", """"Bake in the preheated oven for 5 minutes."""", """"Place spinach in a microwave-safe bowl; microwave until thawed. Drain as much liquid as possible; then dry spinach with paper towels until as dry as possible."""", """"Beat yogurt, eggs, flour, and black pepper together in a bowl until combined; stir in spinach. Layer sliced mushrooms, Cheddar cheese, and chopped scallions, in that order, into pie crust; top with spinach mixture."""", """"Bake in the preheated oven for 15 minutes. Decrease oven temperature to 350 degrees F (175 degrees C); continue baking 30 minutes more. Cool before serving.""""]"";9;5"
"Italian Breakfast Strata;Breakfast And Brunch;Breakfast Casseroles;Chef John's Italian breakfast strata is one of the best breakfast casseroles ever, layered with Italian bread cubes, Italian sausage, plenty of spinach, and melty fontina cheese in just the right amount of egg custard. It has a fantastic fluffy texture, rich and satisfying, and yet somehow not heavy.;""[""""1 large loaf Italian or French bread"""", """"1 tablespoon olive oil"""", """"12 ounces italian sausage"""", """"1 yellow onion"""", """"1/2 teaspoon ground black pepper"""", """"1/4 teaspoon dried oregano"""", """"1/4 teaspoon dried thyme"""", """"1/8 teaspoon dried rosemary"""", """"1 pinch cayenne pepper"""", """"1 pound baby spinach"""", """"12 large eggs"""", """"2 teaspoons kosher salt"""", """"4 cups milk"""", """"8 ounces fontina or fontal cheese, shredded""""]"";""[""""Cut bread into 1-inch cubes, and spread out in a single layer on the work surface; leave uncovered overnight to become stale."""", """"Add olive oil to a skillet set over medium-high heat, and add sausage. Cook, while crumbling with a spatula, for a few minutes, just until the sausage starts to brown. Add onions, a large pinch of salt, black pepper, cayenne, oregano, thyme, and rosemary. Cook, stirring until the onions soften and start to turn translucent."""", """"Transfer the mixture into a bowl, then spoon about 1 tablespoon of rendered sausage fat back into the pan; place pan back over medium-high heat."""", """"Add spinach and cook, tossing with tongs until it's just barely wilted and bright green. Transfer into a strainer to cool. Squeeze out any excess water, and chop before using. Or, use scissors to snip into small pieces."""", """"Whisk eggs with salt until yolks have been incorporated into the whites. Whisk in milk and set aside."""", """"Grease a 9x13-inch casserole dish with olive oil. Cover the bottom with a single tight layer of stale bread cubes. Top evenly with about 60% of sausage mixture, layer on 60% of spinach, and then scatter over half the cheese."""", """"Top this with another layer of bread cubes, pressing down lightly with your hands to flatten. Top bread with remaining sausage and spinach. Ladle egg and milk mixture evenly over casserole. Top with the remaining cheese."""", """"Wrap tightly and place in the refrigerator overnight."""", """"Preheat the oven to 350 degrees F (180 degrees C)."""", """"Bake strata in the preheated oven until top is lightly browned, and an instant read thermometer inserted into the center reaches 150 degrees F (66 degrees C), about 1 hour 15 minutes."""", """"Let strata rest for 10 to 15 minutes before serving.""""]"";14;11"
"Full English Breakfast;Breakfast And Brunch;Breakfast And Brunch;This full English breakfast of baked beans with eggs, bangers and bacon, seared tomatoes and mushrooms, is traditional in the UK. Just add toast!;""[""""1 (8 ounce) can baked beans"""", """"2 tablespoons ketchup"""", """"1 tablespoon HP sauce"""", """"3 slices bacon"""", """"2 bangers (British sausages)"""", """"1 bunch cherry tomatoes on the vine"""", """"5 whole cremini mushrooms"""", """"2 large eggs""""]"";""[""""Place beans in a small saucepan over medium-low heat. Add ketchup and HP sauce, and heat until warmed through, about 5 minutes."""", """"Heat a large skillet over medium heat, and add bacon and sausages. Cook until sausage is browned and bacon is cooked to your taste, about 10 minutes. Remove from the pan and set aside."""", """"Add tomatoes and mushrooms to the skillet, and sear in bacon fat for 2 minutes; remove from the pan."""", """"Add 1 cup water to the pan, crack in eggs, and simmer until whites are opaque and yolks are still runny. Spoon beans onto a plate, and arrange eggs, bacon, bangers, tomatoes, and mushrooms around them.""""]"";8;4"
"Bacon, Potato, and Egg Taco Ole;Breakfast And Brunch;Breakfast Bacon;These potato and egg tacos can be a comforting breakfast or fast dinner food. Onions are sautéed with potatoes and eggs, then served with crispy bacon on warm flour or corn tortillas or buttered toast. Add your favorite salsa for a zesty zip!;""[""""8 bacon strips"""", """"8 eggs"""", """"\u2153 cup milk"""", """"3 tablespoons water"""", """"salt and pepper to taste"""", """"\u2153 cup diced onion"""", """"2 large potatoes, peeled and chopped"""", """"1 tablespoon butter"""", """"4 corn or flour tortilla""""]"";""[""""Place bacon in a skillet over medium-high heat and cook until evenly browned. Remove bacon with a slotted spoon; drain on paper towels. Crumble bacon and set aside. Keep bacon drippings in the skillet."""", """"Mix eggs, milk, water, salt, and pepper in a bowl until combined."""", """"Add potatoes to bacon drippings in the skillet and cook over medium heat until semi-soft. Stir in onions. Cook and stir for 1 minute. Pour egg mixture into the skillet. Stir in crumbled bacon and butter. Cook until eggs set to your desired firmness."""", """"Spoon egg mixture into tortillas and serve.""""]"";9;4"
"Blini - Russian Pancakes;Breakfast And Brunch;Crepes And Blintzes;This recipe was given to me by my Russian teacher/neighbor. It is tried and true, and my family loves it! Cooking time really depends on how many skillets you are using! Many years ago when I first started making the blini, I used 1 skillet and it took forever to use up all the batter. Now I use 4 skillets and the time goes by quickly. I have substituted coconut oil and it tastes delicious, but it tends to harden if the batter is cold. Batter can be refrigerated for later use. Serve hot with sour cream and/or jelly.;""[""""5 eggs"""", """"\u00bd cup white sugar"""", """"1 pinch salt"""", """"4 cups milk"""", """"2 \u00bd cups flour"""", """"6 tablespoons vegetable oil"""", """"1 teaspoon vegetable oil, or as needed, divided""""]"";""[""""Mix eggs, sugar, and salt together in a bowl. Add milk, flour, and oil. Mix until batter is smooth and thin."""", """"Heat 2 small nonstick skillets over medium heat. Lightly oil the skillets. Pour in enough batter to just cover the bottom of each skillet. Tilt the pans to spread batter evenly."""", """"Lift the blini carefully when edges start to brown, about 2 minutes. Flip and cook until the other side is browned, about 1 minute more. Stack blini on a plate.""""]"";7;3"
"Avocado and Egg Breakfast Burrito;Breakfast And Brunch;Breakfast Burritos;A flour tortilla wrapped around soft scrambled eggs, with the savory creaminess of avocado. Add some tomatoes, shredded cheese, and even some cilantro for a great-tasting breakfast burrito that will keep your appetite curbed all day long.;""[""""2 (10 inch) flour tortillas"""", """"1 tablespoon butter"""", """"4 medium eggs"""", """"1 cup shredded mild Cheddar cheese"""", """"1 Hass avocado - peeled, pitted, and sliced"""", """"1 small tomato, chopped"""", """"1 small bunch fresh cilantro, chopped, or to taste (Optional)"""", """"1 pinch salt and ground black pepper to taste"""", """"1 dash hot sauce, or to taste (Optional)""""]"";""[""""Place tortillas on a microwave-safe plate. Place shredded Cheddar cheese in the center of each tortilla, towards 1 end. Microwave on high power to melt cheese, 20 to 30 seconds."""", """"Heat butter in a skillet over medium heat. Whisk eggs together in a bowl. Pour into the skillet; cook and stir until eggs are set, about 5 minutes."""", """"Place eggs over melted cheese on tortillas; top each with avocado, tomato, and cilantro. Season with salt and pepper. Top with hot sauce.""""]"";9;3"
"Tomato Quiche;Breakfast And Brunch;Breakfast Quiche;This delicious tomato quiche is a combination of a couple of recipes that I've made before. It's easy to prepare, looks great, and has lots of lovely basil flavor!;""[""""1 (9-inch) unbaked deep dish pie crust"""", """"1 tablespoon olive oil"""", """"1 onion, thinly sliced"""", """"2 tomatoes, peeled and sliced"""", """"2 tablespoons all-purpose flour"""", """"2 teaspoons dried basil"""", """"3 large eggs, beaten"""", """"\u00bd cup milk"""", """"salt and pepper to taste"""", """"1 \u00bd cups shredded Colby-Monterey Jack cheese, divided""""]"";""[""""Preheat the oven to 400 degrees F (200 degrees C). Bake pie shell in preheated oven for 8 minutes."""", """"Meanwhile, heat olive oil in a large skillet over medium heat. Saut\u00e9 onion until soft; remove from skillet. Sprinkle tomato slices with flour and basil, then saut\u00e9 in the same skillet for 1 minute on each side. Whisk eggs and milk together in a bowl until smooth; season with salt and pepper."""", """"Spread 1 cup shredded cheese in the bottom of pie crust. Layer onions over cheese, and top with tomatoes. Cover with egg mixture; sprinkle remaining 1/2 cup shredded cheese on top."""", """"Bake in preheated oven for 10 minutes. Reduce heat to 350 degrees F (175 degrees C), and continue to bake until filling is puffed and golden brown, about 15 to 20 minutes. Serve warm.""""]"";10;4"
"Carrot Bread;Breakfast And Brunch;Breakfast Bread;This carrot bread is really a cross between cake and a quick bread. It's bursting with shredded carrots, raisins, maraschino cherries, and nuts. It's delicious warm with butter or cream cheese for brunch. It's really good!;""[""""2 \u00bd cups all-purpose flour"""", """"1 cup white sugar"""", """"1 teaspoon baking powder"""", """"1 teaspoon baking soda"""", """"1 teaspoon ground cinnamon"""", """"\u00bd teaspoon salt"""", """"3 large eggs, beaten"""", """"\u00bd cup vegetable oil"""", """"\u00bd cup milk"""", """"2 cups shredded carrots"""", """"1 (3.5 ounce) package flaked coconut"""", """"\u00bd cup maraschino cherries, chopped"""", """"\u00bd cup raisins"""", """"\u00bd cup chopped walnuts""""]"";""[""""Gather all ingredients. Preheat the oven to 350 degrees F (175 degrees C). Lightly grease a 9x5-inch loaf pan."""", """"Sift flour, sugar, baking powder, baking soda, cinnamon, and salt together in a large bowl."""", """"Combine eggs, oil, and milk in a separate bowl; stir into flour mixture until well blended."""", """"Stir in carrots, coconut, cherries, raisins, and walnuts."""", """"Pour batter into prepared loaf pan."""", """"Bake in the preheated oven until a toothpick inserted into center of the loaf comes out clean, about 50 to 60 minutes. Let cool on a wire rack for 10 minutes before removing from the pan to cool completely.""""]"";14;6"
"Gluten-Free Crepes;Breakfast And Brunch;Crepes And Blintzes;Great tasting gluten-free crepe recipe. Works well every time.;""[""""1 cup rice flour"""", """"3 large eggs"""", """"\u00bd cup almond milk"""", """"3 tablespoons white sugar"""", """"1 pinch salt"""", """"1 cup warm water"""", """"3 \u00bd tablespoons coconut oil, divided""""]"";""[""""Whisk rice flour, eggs, almond milk, sugar, and salt together in a large bowl until well mixed."""", """"Combine water and 3 tablespoons coconut oil in a separate bowl until well blended. Whisk into the flour mixture. Pour batter through a sieve into a clean bowl; cover with plastic wrap and refrigerate for 1 hour."""", """"Heat remaining coconut oil in a griddle over medium heat. Ladle a portion of the batter into the pan and spread out. Cook until set, about 30 seconds per side. Repeat with the remaining batter.""""]"";7;3"
"Bacon and Egg Breakfast Tarts;Breakfast And Brunch;Breakfast Bacon;These breakfast tarts are perfect for brunch but also convenient enough for serving on a weekday.;""[""""1 (11 ounce) package pie crust mix"""", """"2 tablespoons cold water"""", """"2 teaspoons cold water"""", """"1 (6 ounce) package Canadian-style bacon"""", """"1 cup shredded Cheddar cheese"""", """"4 large eggs"""", """"\u00bc cup milk"""", """"\u00bc teaspoon ground nutmeg"""", """"\u00bc teaspoon ground black pepper""""]"";""[""""Preheat the oven to 425 degrees F (220 degrees C)."""", """"Stir together 1 1/3 cups pie crust mix and 2 tablespoons plus 2 teaspoons cold water in a large bowl until pastry forms a ball; save remaining pie crust mix for another use. Divide pastry ball into 4 equal pieces."""", """"Roll each piece into a 6-inch circle on a floured surface. Drape each circle over inverted large 3x1 1/2-inch muffin cups or 6-ounce custard cups; make pleats, so pastry fits snugly against the cup. Prick surface using a fork. Place on an ungreased cookie sheet."""", """"Bake in the preheated oven until light brown, 8 to 10 minutes. Cool for 5 minutes, then carefully remove tart shells from cups. Reduce oven temperature to 350 degrees F (175 degrees C)."""", """"Place 2 bacon slices into the bottom of each tart shell. Sprinkle with Cheddar cheese, making a small well in each. Break 1 egg into each well and add 1 tablespoon milk into each tart. Sprinkle with nutmeg and pepper. Place filled tarts on the same ungreased cookie sheet."""", """"Bake in the preheated oven until eggs are soft-cooked, 15 to 20 minutes.""""]"";9;6"
"Banana Wake-Up Bars;Breakfast And Brunch;Breakfast Cookies;These banana bars are soft and simple but delicious and made with yummy ingredients. They're always a big hit when I make them for my friends and bring them to school.;""[""""\u2153 cup peanut butter"""", """"\u2153 cup brown sugar"""", """"2 \u00bd tablespoons butter, soft"""", """"1 large egg"""", """"\u00bd teaspoon vanilla extract"""", """"1 ripe banana, mashed"""", """"\u2154 cup rolled oats"""", """"\u2153 cup all-purpose flour"""", """"2 tablespoons wheat germ"""", """"\u00bc teaspoon baking soda""""]"";""[""""Preheat the oven to 350 degrees F (175 degrees C). Grease a 9x9-inch baking pan."""", """"Beat together peanut butter, brown sugar, and butter in a large bowl with an electric mixer until smooth and fluffy. Beat in egg and vanilla until incorporated. Mix in mashed banana. Stir in oats, flour, wheat germ, and baking soda until batter is well combined. Spread batter in the prepared baking pan."""", """"Bake in the preheated oven until set and lightly browned, 20 to 25 minutes. Remove from the oven and cool completely in the pan on a wire rack before cutting into bars.""""]"";10;3"
"Cinnamon Apple Baked French Toast;Breakfast And Brunch;French Toast;This twist on a classic french toast adds in apples and honey to create a crisp summertime breakfast.;""[""""1 loaf challah"""", """"6 large eggs, at"""", """"1 cup Almond Breeze Unsweetened Vanilla Almondmilk"""", """"1/4 cup maple syrup"""", """"2 teaspoons cinnamon"""", """"1 tablespoon vanilla extract"""", """"1/4 teaspoon salt"""", """"2 medium apples, thinly sliced"""", """"1/2 cup Blue Diamond Almonds"""", """"powdered sugar for dusting (optional)""""]"";""[""""Preheat the oven to 350 degrees F (175 degrees C). Line a standard-sized loaf pan with parchment paper. Set aside. Cut bread into 1 inch thick slices. Set aside."""", """"Whisk eggs, maple syrup or honey, cinnamon, vanilla extract, and salt together in a bowl. Stir in Almond BreezeUnsweetened Vanilla Almondmilk. Soak sliced bread in the mixture, turning to coat both sides evenly."""", """"Meanwhile, slice apples horizontally into thin rings. Use a corer or a metal frosting tip to core the apple core from the slices."""", """"Layer soaked bread slices and apples in the prepared loaf pan, alternating 1 slice of bread to 3 slices of apples. If you have any egg mixture left over once you're done, pour it over the entire loaf. Sprinkle with chopped Blue Diamond Almonds and cover loosely with foil."""", """"Bake in the preheated oven for 45 to 50 minutes, removing the tin foil after 30 minutes. Allow to cool for 10 minutes before sprinkling with powdered sugar!"""", """"To serve, use a bread knife to cut slices from the loaf. Drizzle with maple syrup!""""]"";10;6"
"Easy Sausage Gravy and Biscuits;Breakfast And Brunch;Breakfast Sausage;This biscuits and gravy recipe uses jumbo buttermilk biscuits and pork sausage crumbles for a hearty, family-favorite breakfast that's ready in just 15 minutes.;""[""""1 (16 ounce) can refrigerated jumbo buttermilk biscuits"""", """"1 (9.6 ounce) package Jimmy Dean\u00ae Original Hearty Pork Sausage Crumbles"""", """"\u00bc cup flour"""", """"2 \u00bd cups milk"""", """"salt and freshly ground black pepper to taste""""]"";""[""""Gather all ingredients."""", """"Preheat the oven to 350 degrees F (175 degrees C). Arrange biscuits 1 to 2 inches apart on an ungreased cookie sheet. Bake in the preheated oven until golden brown, about 13 to 15 minutes."""", """"Meanwhile, cook sausage in a large skillet over medium heat until thoroughly heated, stirring frequently, about 5 to 6 minutes."""", """"Stir in flour until well combined."""", """"Gradually add milk, stirring continuously, until the gravy thickens and comes to a boil. Reduce heat to medium-low; simmer and stir for 2 more minutes. Season to taste with salt and pepper."""", """"Split biscuits in half. Place 2 halves on each of 8 plates; top with about 1/3 cup gravy.""""]"";5;6"
