recipe_title;category;subcategory;description;ingredients;directions;num_ingredients;num_steps
"Overnight Baked Oatmeal;Breakfast And Brunch;Breakfast And Brunch;This overnight baked oatmeal has a tender, yet chewy texture, fun flavor combination ideas, and just the right amount of sweetness and spice.;""[""""2 large eggs"""", """"2 cups milk or unsweetened plant milk of your choice"""", """"1/4 cup maple syrup"""", """"1/4 cup packed brown sugar"""", """"1 teaspoon vanilla extract"""", """"1 teaspoon ground cinnamon"""", """"1/2 teaspoon salt"""", """"2 cups rolled oats (not quick cooking)"""", """"1/3 cup amaranth""""]"";""[""""Gather all ingredients."""", """"Grease a 2-quart rectangular baking dish."""", """"Whisk eggs, milk, maple syrup, brown sugar, vanilla, cinnamon, and salt together in the prepared dish."""", """"Stir in oats and amaranth. If desired, stir in flavor variation mix-ins (see below)."""", """"Cover and chill at least overnight or up to 3 days."""", """"Preheat the oven to 350 degrees F (180 degrees C). Uncover and stir to re-incorporate all of the ingredients."""", """"Bake, uncovered, until golden brown and the center is set, 45 to 55 minutes."""", """"Let stand 10 minutes before serving. Serve warm.""""]"";9;8"
"Easy French Toast Casserole;Breakfast And Brunch;Breakfast Casseroles;This French toast casserole combines all the ingredients of traditional French toast in an easy overnight method. No more flipping individual slices of French toast—make this easy casserole the night before and pop it in the oven in the morning for a casual weekend or holiday breakfast.;""[""""1 cup brown sugar"""", """"1/2 cup unsalted butter"""", """"1 (8-ounce) loaf crusty French bread, cut into bite-sized pieces, or more as needed"""", """"2 cups milk"""", """"6 large eggs"""", """"2 teaspoons vanilla extract""""]"";""[""""Gather all ingredients. Grease a 9x13-inch baking dish."""", """"To make the French toast: Stir brown sugar and butter together in a saucepan over medium-low heat until butter is melted and sugar has dissolved, 2 to 4 minutes. Pour butter-brown sugar mixture into the prepared baking dish."""", """"Scatter French bread pieces over top in a 1 \u00bd- to 2-inch layer."""", """"Whisk milk, eggs, and vanilla together in a bowl until well combined. Pour over bread pieces, then press bread down with a spatula so the bread absorbs the liquid. Cover with plastic wrap and refrigerate for 8 hours to overnight."""", """"When ready to bake, remove French toast from the refrigerator and discard plastic wrap. Preheat the oven to 350 degrees F (175 degrees C)."""", """"To make the topping: Mix brown sugar and cinnamon together in a small bowl; sprinkle evenly over the top of French toast."""", """"Bake in the preheated oven until casserole is golden brown and set in the center, 50 to 60 minutes.."""", """"Cut into squares; serve with some of the caramel from the bottom of the pan spooned on top.""""]"";6;8"
"Louisiana Sweet Potato Pancakes;Breakfast And Brunch;Breakfast Potatoes;These sweet potato pancakes with nutmeg are a very welcome change from regular pancakes. Great with maple syrup or cranberry sauce.;""[""""\u00be pound sweet potatoes"""", """"1 \u00bd cups all-purpose flour"""", """"3 \u00bd teaspoons baking powder"""", """"1 teaspoon salt"""", """"\u00bd teaspoon ground nutmeg"""", """"1 \u00bd cups milk"""", """"\u00bc cup unsalted butter, melted"""", """"2 large eggs, beaten""""]"";""[""""Bring a medium saucepan of lightly salted water to a boil. Add sweet potatoes and cook until tender but still a bit firm, about 15 minutes. Drain, then immediately immerse in cold water to loosen skins. Drain again; remove and discard skins."""", """"Sift flour, baking powder, salt, and nutmeg together into a medium bowl."""", """"Chop sweet potatoes, transfer to another medium bowl, and mash. Mix in milk, melted butter, and egg. Gradually mix in flour mixture until well combined."""", """"Lightly grease a griddle and preheat over medium-high heat."""", """"Working in batches, drop heaping tablespoonfuls batter onto the hot griddle and cook until the surface begins to bubble, 3 to 4 minutes. Flip and cook on the other side until golden brown, 2 to 3 more minutes.""""]"";8;5"
"Bacon Jam;Breakfast And Brunch;Breakfast Bacon;This recipe can be used for spooning on Granny's old-fashion biscuits, or put a dollop on fluffy scrambled eggs. On a toasted slice of a crusty bread or good crackers it would be divine. Whatever you use this for, it will work beautifully, because everything is better with bacon!;""[""""2 pounds bacon, cut into 1-inch pieces"""", """"\u00bd cup bacon drippings"""", """"2 large yellow onions, cut into very thin slivers"""", """"\u00bd cup brown sugar"""", """"\u00bc cup garlic, minced"""", """"1 teaspoon ground cayenne pepper"""", """"\u00bd teaspoon ground cinnamon"""", """"\u00bd teaspoon ground nutmeg"""", """"1 cup bourbon whiskey"""", """"1 cup brewed coffee"""", """"\u00bd cup sherry vinegar"""", """"\u00bd cup maple syrup"""", """"\u00be cup ketchup""""]"";""[""""Cook and stir bacon in a large saucepan over medium-high heat until bacon starts to brown, about 10 minutes; drain grease, retaining 1/4 of the drippings. Stir onions into bacon and drippings; cook and stir until soft, about 10 minutes. Stir in brown sugar; cook until onions are sticky and browned, about 5 more minutes. Mix in garlic, cayenne pepper, cinnamon, and nutmeg. Cook and stir until garlic is soft, about 5 minutes."""", """"Mix in bourbon whiskey, coffee, sherry vinegar, and maple syrup. Bring to a boil, reduce heat to low, and cook until the bacon jam is thickened but not completely dry, stirring occasionally to prevent burning, about 35 minutes. Mix in ketchup and cook 5 more minutes."""", """"Remove from heat, let the bacon jam cool, and pulse in a food processor to a slightly chunky, spreadable consistency. Bacon jam will store in the refrigerator, covered, up to 2 weeks.""""]"";13;3"
"Hot Breakfast Couscous;Breakfast And Brunch;Breakfast Bowls;When I went on a six-day kayaking trip, our guides whipped up this breakfast couscous one morning over the campfire. It was delicious, and I started making it at home.;""[""""2 cups skim milk"""", """"2 tablespoons honey"""", """"1 tablespoon ground cinnamon"""", """"2 cups dry couscous"""", """"\u00bd cup slivered almonds"""", """"\u2153 cup chopped dried apricots"""", """"\u2153 cup raisins""""]"";""[""""Combine milk, honey and cinnamon in a saucepan over medium heat. As soon as it comes to a boil, stir in couscous. Turn off heat."""", """"Cover and let stand for 5 minutes. Stir in almonds, apricots, and raisins.""""]"";7;2"
"Cinnamon Toast;Breakfast And Brunch;Breakfast Bread;Yummy cinnamon toast makes a great breakfast or snack!;""[""""2 slices white bread"""", """"2 teaspoons butter or margarine"""", """"2 tablespoons white sugar"""", """"1 teaspoon ground cinnamon""""]"";""[""""Toast bread slices in a toaster to desired darkness."""", """"Spread butter or margarine onto one side of each slice."""", """"Stir together sugar and cinnamon in a small bowl."""", """"Sprinkle cinnamon-sugar mixture generously over hot, buttered toast.""""]"";4;4"
"Oatmeal Pancakes;Breakfast And Brunch;Pancakes;I make these oatmeal pancakes for my kids. The recipe is so simple — the batter with oats and buttermilk is prepared in a food processor or blender, so it's ready to cook in minutes. Serve with syrup and butter or a dollop of applesauce.;""[""""\u00be cup buttermilk"""", """"\u00bd cup all-purpose flour"""", """"\u00bd cup quick cooking oats"""", """"1 large egg"""", """"2 tablespoons vegetable oil"""", """"1 tablespoon white sugar"""", """"1 teaspoon vanilla extract"""", """"1 teaspoon baking powder"""", """"\u00bd teaspoon baking soda"""", """"\u00bd teaspoon salt""""]"";""[""""Gather all ingredients."""", """"Combine buttermilk, flour, oats, egg, oil, sugar, vanilla, baking powder, baking soda, and salt in a blender; pur\u00e9e until smooth."""", """"Heat a lightly oiled griddle or large skillet over medium-high heat. Pour 1/4 cupfuls batter onto the hot griddle. Cook until bubbles form on the surface, 1 to 2 minutes. Flip and cook until browned on the other side, 1 to 2 minutes more."""", """"Serve immediately.""""]"";10;4"
"Easy Potato Pancakes;Breakfast And Brunch;Healthy Breakfast And Brunch;Learn how to make potato pancakes with this easy recipe. My family loves them as a side dish or for Sunday brunch. Top them with sour cream and green onions or a dollop of applesauce.;""[""""5 medium potatoes, peeled and shredded"""", """"1 medium onion, finely chopped"""", """"2 large eggs, beaten"""", """"3 tablespoons all-purpose flour"""", """"salt and pepper to taste"""", """"3 tablespoons vegetable oil""""]"";""[""""Combine potatoes, onion, eggs, flour, salt, and pepper in a large bowl; stir until well combined."""", """"Heat oil in a large skillet over medium-high heat. Working in batches, drop large spoonfuls of potato batter into the hot skillet. Flatten batter lightly with a spatula and cook until golden brown, about 4 minutes per side. Serve immediately.""""]"";6;2"
"Cranberry Orange Bread;Breakfast And Brunch;Breakfast Bread;This cranberry orange bread recipe makes a delicious festive treat full of bright, fresh flavor. It's great for breakfast or a snack. You can also use this recipe to make muffins.;""[""""2 cups flour"""", """"\u00be cup white sugar"""", """"1 \u00bd teaspoons baking powder"""", """"\u00be teaspoon salt"""", """"\u00bd teaspoon baking soda"""", """"\u00bc cup unsalted butter, cut into pieces and softened"""", """"\u00be cup orange juice"""", """"1 tablespoon grated orange zest"""", """"1 large egg, beaten"""", """"1 cup chopped cranberries"""", """"\u00bd cup chopped walnuts (Optional)""""]"";""[""""Gather all ingredients."""", """"Preheat the oven to 350 degrees F (175 degrees C). Grease a 8x4-inch loaf pan."""", """"Combine flour, sugar, baking powder, salt, and baking soda in a bowl. Stir butter into flour mixture until combined. Add orange juice, orange zest, and egg; mix well."""", """"Fold in cranberries and walnuts. Spoon batter into the prepared pan."""", """"Bake in the preheated oven until a toothpick inserted into the center comes out clean, 60 to 75 minutes."""", """"Cool in the pan for 10 minutes before removing to cool completely on a wire rack.""""]"";11;6"
"Eggs in a Basket;Breakfast And Brunch;Breakfast Eggs;Eggs are baked in a golden basket of grated potato for a simple breakfast that's fun to make.;""[""""cooking spray"""", """"3 large potatoes, peeled and grated"""", """"\u00bc cup butter, melted"""", """"kosher salt and ground black pepper to taste"""", """"6 large eggs"""", """"\u00be cup shredded provolone cheese"""", """"6 slices prosciutto"""", """"2 teaspoons maple syrup""""]"";""[""""Preheat the oven to 350 degrees F (175 degrees C). Grease a large 6-cup muffin tin or 6 (6-ounce) custard cups with cooking spray."""", """"Mix potatoes, melted butter, salt, and pepper together in a large bowl."""", """"Divide potato mixture among cups. Press to create a thin crust over the bottom and up the sides of each cup."""", """"Bake in the preheated oven until edges are a light golden brown and potatoes are tender, about 30 to 40 minutes. Crack an egg gently into each cup. Continue cooking until egg whites are set and yolk is runny, 10 to 15 minutes. Remove from the oven; cover eggs with provolone cheese."""", """"Set oven rack about 6 inches from the heat source and preheat the oven's broiler."""", """"Toss prosciutto with maple syrup and pepper in a small bowl. Spread out on a small baking sheet lined with aluminum foil."""", """"Place egg baskets and baking sheet under the preheated broiler. Broil until cheese is melted on top of baskets and prosciutto is crisp, about 1 minute."""", """"Transfer egg baskets to a serving plate. Chop prosciutto and sprinkle on top.""""]"";8;8"
"Gochujang Scrambled Eggs;Breakfast And Brunch;Breakfast And Brunch;These gochujang scrambled eggs are both sweet and savory, and the Korean chile paste adds just the right amount of spice. I like to take it up a notch by adding deli ham.;""[""""2 large eggs"""", """"1 tablespoon heavy whipping cream"""", """"1 tablespoon gochujang"""", """"1/2 tablespoon butter"""", """"2 slices deli ham"""", """"salt and freshly ground black pepper to taste"""", """"sliced green onions (optional)""""]"";""[""""Whisk eggs, heavy cream, and gochujang in a bowl. Set aside."""", """"Melt butter in a skillet. Add egg mixture and ham,, and cook and stir until eggs are scrambled and cooked. Season with salt and pepper. Sprinkle with green onions.""""]"";7;2"
"Great Easy Waffles;Breakfast And Brunch;Waffles;This recipe has been handed down in my family and has become a favorite. If you have leftover waffles, they are great to freeze and then toast at a later time. I usually make a double recipe and then have plenty of leftovers for the kids to have for breakfast before school.;""[""""2 cups all-purpose flour"""", """"2 teaspoons baking powder"""", """"2 tablespoons white sugar"""", """"\u00bd teaspoon salt"""", """"2 egg whites"""", """"2 egg yolks"""", """"2 tablespoons grated lemon zest"""", """"1 teaspoon vanilla extract"""", """"2 cups milk"""", """"6 tablespoons butter, melted""""]"";""[""""Preheat a waffle iron according to manufacturer's instructions."""", """"Whisk the flour, baking powder, sugar, and salt together in a mixing bowl; set aside. Beat egg whites until foamy in a separate large glass or metal mixing bowl. Whisk the egg yolks, lemon zest, and vanilla extract together in a third bowl; whisk in the milk. Stir in the flour mixture until smooth. Fold in the melted butter and then the beaten egg whites until just incorporated."""", """"Cook the waffles according to manufacturer's instructions until golden brown.""""]"";10;3"
"Instant Oatmeal Breakfast Cookies;Breakfast And Brunch;Breakfast Cookies;Be warned: These breakfast cookies are addictive. I took a basic oatmeal cookie recipe and pumped it up. It has whole wheat flour so it's filling and excellent as a breakfast cookie. I gave a friend this recipe and her family can't get enough. Incredible flavor!;""[""""1 cup butter, softened"""", """"1 cup white sugar"""", """"\u00be cup brown sugar"""", """"\u00bd cup cinnamon-flavored applesauce"""", """"1 egg"""", """"1 teaspoon vanilla extract"""", """"\u00bd teaspoon coconut extract"""", """"\u00bd teaspoon almond extract"""", """"1 cup cake flour"""", """"1 teaspoon baking soda"""", """"1 teaspoon salt"""", """"1 cup raisins"""", """"4 (1.23 ounce) packages instant apple-cinnamon oatmeal"""", """"\u00bd cup dried cranberries"""", """"1 cup whole wheat flour""""]"";""[""""Preheat the oven to 375 degrees F (190 degrees C)."""", """"Mix together butter, white sugar, brown sugar, applesauce, egg, vanilla, coconut extract, and almond extract in a large bowl until smooth in texture. Add cake flour, baking soda, and salt; mix until blended. Stir in raisins, instant oatmeal, and dried cranberries. Mix in whole wheat flour, 1/2 cup at a time, until blended. Drop tablespoon-sized scoops of dough onto a nonstick cookie sheet and flatten dough with a spoon."""", """"Bake in the preheated oven until golden brown, 8 to 10 minutes. Place on a wire rack to cool.""""]"";15;3"
"Air Fryer Mini Breakfast Burritos;Breakfast And Brunch;Breakfast Burritos;These grab-and-go air fryer mini breakfast burritos are even great for a midday snack. Leave out the serrano chile pepper for a less spicy version.;""[""""\u00bc cup Mexican-style chorizo"""", """"1 tablespoon bacon grease"""", """"\u00bd cup diced potatoes"""", """"2 tablespoons chopped onion"""", """"1 serrano pepper, chopped"""", """"2 large eggs"""", """"salt and ground black pepper to taste"""", """"4 (8 inch) flour tortillas"""", """"avocado oil cooking spray""""]"";""[""""Cook chorizo in a large skillet over medium-high heat, stirring frequently, until it turns dark red, 6 to 8 minutes. Remove from the skillet."""", """"Melt bacon grease in the same skillet over medium-high heat. Add diced potatoes and cook, stirring occasionally, 8 to 10 minutes. Add onion and serrano pepper; cook and stir until potatoes are fork-tender, onion is translucent, and serrano pepper is soft, 2 to 6 minutes. Add eggs and chorizo; stir until cooked and completely incorporated into potato mixture, about 5 minutes. Season with salt and pepper."""", """"Meanwhile, heat tortillas in a large skillet or directly over the grates of a gas stove until soft and pliable. Place 1/3 cup chorizo mixture down the center of a tortilla. Fold top and bottom of tortilla over the filling, then roll into a burrito shape. Mist with cooking spray and place into the air fryer basket. Repeat to make remaining burritos."""", """"Air-fry at 400 degrees F (200 degrees C) for 4 to 6 minutes. Flip each burrito over, mist with cooking spray, and air-fry until lightly browned, 2 to 4 minutes more.""""]"";9;4"
"Cornbread Sausage Casserole;Breakfast And Brunch;Breakfast Sausage;This cornbread sausage casserole is two layers of cheesy, jalapeño cornbread surrounding savory breakfast sausage for two great tastes in every bite.;""[""""cooking spray"""", """"1 pound ground pork breakfast sausage"""", """"1 (16 ounce) package dry cornbread mix"""", """"1 (15 ounce) can cream-style corn"""", """"5 fluid ounces water"""", """"1 medium onion, diced"""", """"4 fresh jalapeno peppers, diced"""", """"1 (8 ounce) package shredded Cheddar-Monterey Jack cheese blend""""]"";""[""""Preheat the oven to 350 degrees F (175 degrees C). Lightly grease a medium baking dish with cooking spray."""", """"Cook sausage in a large, deep skillet over medium-high heat until evenly browned and crumbly, 5 to 7 minutes. Drain."""", """"Mix cornbread mix, corn, and water together in a medium bowl. Spread 1/2 of the cornbread mixture over the bottom of the prepared baking dish. Layer sausage over top, then onion, jalape\u00f1o, and cheese. Top with remaining cornbread mixture, using only as much as fits in the baking dish."""", """"Bake in the preheated oven until a toothpick inserted in the center comes out clean, about 35 minutes. Let cool for about 10 minutes before serving.""""]"";8;4"
"Bacon Gravy for Biscuits;Breakfast And Brunch;Southern Breakfast And Brunch;This bacon gravy recipe is quick and easy to make. Nothing makes biscuits better than being smothered in a Southern-style bacon gravy. Delightful!;""[""""1 (10 ounce) can refrigerated biscuit dough"""", """"4 thick slices bacon"""", """"\u00bc cup all-purpose flour"""", """"1 cup milk, or as needed"""", """"salt and pepper to taste""""]"";""[""""Gather all ingredients."""", """"Preheat the oven to 400 degrees F (200 degrees C). Place biscuits in an ungreased baking pan."""", """"Bake in the preheated oven until golden brown, 10 to 13 minutes or as directed on the package instructions."""", """"While the biscuits are baking, cook bacon in a deep skillet over medium heat until crisp, about 10 minutes."""", """"Transfer bacon to a paper towel-lined plate, reserving bacon grease in the skillet. Whisk flour into bacon grease until smooth."""", """"Add milk and continue to stir over medium heat until thickened."""", """"Crumble bacon into gravy and season with salt and pepper."""", """"Split biscuits in half and top with gravy.""""]"";5;8"
"Mexican Breakfast Tacos;Breakfast And Brunch;Breakfast Burritos;These Mexican breakfast tacos are quick, easy, and delicious! I learned this recipe from the cooks at my restaurant who like to sneak in breakfast before we open. I've grown to love this breakfast. If you like spicy food, you will love it, too.;""[""""6 ounces chorizo sausage"""", """"cooking spray"""", """"6 large eggs"""", """"\u00bc cup milk"""", """"\u00bd teaspoon salt"""", """"\u00bd teaspoon pepper"""", """"8 (6 inch) corn tortillas"""", """"1 cup shredded Monterey Jack cheese"""", """"\u00bd cup salsa"""", """"1 dash hot pepper sauce (e.g. Tabasco\u2122), or to taste""""]"";""[""""Heat a large skillet over medium-high heat. Cook and stir sausage in the hot skillet until browned and crumbly, 5 to 7 minutes. Remove sausage to a plate. Drain and discard grease; wipe the skillet clean with a paper towel."""", """"Place the same skillet over medium heat and grease with cooking spray. Whisk together eggs, milk, salt, and pepper in a medium bowl; pour into the prepared skillet. Cook and gently stir until scrambled and almost dry. Add sausage; continue to cook and stir until firm."""", """"Meanwhile, warm a second skillet over high heat. Cook tortillas until hot and crispy on the edges, but still pliable, about 45 seconds per side."""", """"Sprinkle Monterey Jack cheese evenly onto hot tortillas. Top each with scrambled eggs, salsa, and hot pepper sauce.""""]"";10;4"
"Asparagus Quiche;Breakfast And Brunch;Breakfast Bacon;This asparagus quiche has a delectable combination of tender asparagus, crisp bacon pieces, and Swiss cheese for a tasty brunch, lunch, or dinner.;""[""""1 pound fresh asparagus, trimmed and cut into \u00bd-inch pieces"""", """"10 slices bacon"""", """"2 (8-inch) unbaked pie shells"""", """"1 egg white, lightly beaten"""", """"2 cups shredded Swiss cheese"""", """"4 large eggs"""", """"1 \u00bd cups half-and-half cream"""", """"\u00bc teaspoon ground nutmeg"""", """"salt and pepper to taste""""]"";""[""""Preheat the oven to 400 degrees F (200 degrees C)."""", """"Place asparagus in a steamer over 1 inch of boiling water. Cover and cook until tender but still firm, 2 to 6 minutes. Drain and cool."""", """"Place bacon in a large skillet and cook over medium-high heat, turning occasionally, until evenly browned, about 10 minutes. Drain bacon slices on paper towels. Crumble and set aside."""", """"Brush pie shells with beaten egg white. Sprinkle crumbled bacon and steamed asparagus into pie shells; sprinkle Swiss cheese over bacon and asparagus."""", """"Beat eggs, half-and-half, nutmeg, salt, and pepper in a bowl until well combined. Pour egg mixture on top of cheese."""", """"Bake quiches in the preheated oven until filling is set, about 35 to 40 minutes. Let cool to room temperature before serving.""""]"";9;6"
"Sheet Pan Egg in a Hole with Bacon and Brussels Sprout Slaw;Breakfast And Brunch;Southern Breakfast And Brunch;Shaved Brussels sprout slaw and a maple vinaigrette elevate the classic egg in a hole breakfast dish.;""[""""6 tablespoons butter, softened"""", """"6 slices sourdough bread"""", """"6 slices thick-cut bacon"""", """"1/3 cup mayonnaise"""", """"1 tablespoon ijon mustard"""", """"1 tablespoon maple syrup"""", """"1 tablespoon cider vinegar"""", """"1/8 teaspoon salt"""", """"1/8 teaspoon black pepper, plus more for garnish"""", """"1 (9-10-ounce) package russels sprouts"""", """"1 shallot, thinly sliced"""", """"6 large eggs"""", """"grated Parmesan cheese, for garnish""""]"";""[""""Preheat the oven to 400 degrees F (200 degrees C). Line a 13x18-inch rimmed sheet pan with parchment paper or foil."""", """"Spread butter on both sides of bread slices; arrange in an even layer on the prepared sheet pan. Bake for 7 minutes; turn slices and bake until lightly toasted, about 3 minutes more."""", """"Using a 2 1/2-inch biscuit cutter or straight-sided glass, remove a hole from the center of each toast slice. Set toast slices and rounds aside."""", """"Arrange bacon in an even layer on the same sheet pan. Bake, turning halfway through, until crisp, 15 to 20 minutes."""", """"Meanwhile, for slaw, whisk together mayonnaise, mustard, maple syrup, vinegar, table salt, and pepper in a bowl. Add Brussels sprouts and shallot; toss to coat."""", """"Transfer bacon to a paper towel-lined plate; let cool. Pour off excess drippings from the pan, leaving parchment or foil in place. Return toast slices to pan, reserving rounds. Crack an egg into each hole."""", """"Bake until whites are set and yolks are desired doneness, 7 to 9 minutes."""", """"Crumble bacon; sprinkle evenly over eggs. Top with slaw. Garnish with flaky salt, Parmesan cheese, and/or additional pepper. If you like, top with reserved toast rounds.""""]"";13;8"
"Easy Sausage Pancakes;Breakfast And Brunch;Breakfast And Brunch;These easy sausage pancakes are ready in a few minutes - all you need is pancake mix and sausage patties and you have a yummy breakfast treat.;""[""""2 cups pancake mix"""", """"1 1/3 cups water, plus more as needed"""", """"3 tablespoons butter, divided"""", """"8 sausage patties"""", """"syrup for dipping""""]"";""[""""Combine pancake mix and water in a bowl and stir until just blended (there may be a few lumps)."""", """"Heat half of the butter in a large nonstick skillet over medium heat until melted."""", """"Dip half of the sausage patties in the batter until evenly coated and place in the skillet. Cook undisturbed until lightly browned and slightly puffed, 2 to 3 minutes. Flip and cook until the pancake is cooked through, 2 to 3 more minutes."""", """"Repeat with remaining batter and sausage. Serve with syrup if desired for dipping.""""]"";5;4"
"Waffles II;Breakfast And Brunch;Waffles;Very easy! You will never use a mix for waffles again!;""[""""2 cups all-purpose flour"""", """"4 teaspoons baking powder"""", """"\u00bc teaspoon salt"""", """"1 \u00bd cups milk"""", """"6 tablespoons vegetable oil"""", """"2 eggs, separated""""]"";""[""""Preheat waffle iron. In a large mixing bowl, sift together flour, baking powder and salt. Stir in milk, oil and egg yolks until mixture is smooth. In a separate bowl, beat egg whites until soft peaks form. Gently fold egg whites into batter."""", """"Spray preheated waffle iron with non-stick cooking spray. Pour mix onto hot waffle iron. Cook until golden; serve hot.""""]"";6;2"
