recipe_title;category;subcategory;description;ingredients;directions;num_ingredients;num_steps
"Chef John's Corned Beef Hash;Breakfast And Brunch;Breakfast Potatoes;""When I cook corned beef and watch it simmer in the aromatic broth, I'll sometimes close my eyes and picture the delicious plate of food I have coming. The funny thing is, it's not the sliced corned beef and cabbage I'm dreaming of; it's the diner-style corned beef hash recipe I'm going to make with the leftovers. Garnish with green onions and a poached egg."";""[""""1 \u00bd pounds potatoes, peeled and quartered"""", """"1 \u00bd pounds cooked corned beef, finely chopped"""", """"1 bunch green onions, chopped"""", """"salt and ground black pepper to taste"""", """"2 cloves garlic, crushed"""", """"1 tablespoon butter"""", """"\u00bc cup roasted tomato salsa""""]"";""[""""Place potatoes in a large pot and cover with salted water; bring to a boil. Reduce heat to medium-low and simmer until almost tender but still firm, about 15 minutes. Drain and finely chop."""", """"Cook beef in a large cast iron or nonstick skillet over medium heat until fat begins to render. Stir green onions, salt, and pepper into beef. Add garlic and butter; cook and stir until butter is melted and garlic is fragrant, 1 to 2 minutes."""", """"Stir potatoes, salsa, and a pinch of salt into beef mixture. Pat mixture down in the skillet with a spatula and divide hash into 4 sections."""", """"Cook, without stirring, until a crust forms on the bottom, about 5 minutes. Flip sections and cook until a crust forms on the bottom, about 5 minutes more. Repeat cooking and flipping process, flipping every 5 minutes, until hash stays together and has a golden crust, 10 to 15 minutes.""""]"";7;4"
"Boursin Omelet;Breakfast And Brunch;Breakfast Eggs;This Boursin omelet is a quick, luxurious breakfast that brings creamy texture and rich flavor to the classic omelet. Finish with a sprinkle of chives for a fresh pop of color.;""[""""3 large eggs"""", """"1 teaspoon water"""", """"salt and freshly ground black pepper to taste"""", """"1 tablespoon butter"""", """"1 tablespoon chives"""", """"1 ounce cheese, such as""""]"";""[""""Whisk eggs, water, salt, and pepper together in a bowl until yolks and whites are completely combined and eggs are light and frothy, about 30 seconds."""", """"Melt butter in an 8-inch nonstick skillet over medium heat. Pour eggs into skillet and stir rapidly for 20 to 30 seconds until eggs are just starting to set. Spread top of eggs in an even layer and let cook until just slightly underdone and shiny. If necessary, move extra raw egg around to the edges of the skillet. Lower heat to medium-low to prevent browning, if necessary."""", """"Sprinkle cheese down the middle of the omelet, along with 2 teaspoons chives. Fold one side over the cheese in the middle, followed by the other side, so the omelet is folded in thirds. Remove to a plate and sprinkle with remaining chives.""""]"";6;3"
"Carnation Breakfast Chocolate Craver's Delight Cookies;Breakfast And Brunch;Breakfast Cookies;An over-the-top chocolate cookie comprised of a milk chocolate base using Carnation Breakfast Essentials® combined with coconut, almond extract, and a blast of mini semisweet chocolate chips to curb those chocolate cravings!;""[""""2 packets CARNATION BREAKFAST ESSENTIALS\u00ae Rich Milk Chocolate High Protein Powder Drink Mix"""", """"\u00be cup white sugar"""", """"\u00bd cup butter, softened"""", """"\u00bd cup vegetable shortening"""", """"\u00bc cup brown sugar"""", """"2 eggs (Optional)"""", """"2 \u00bc cups all-purpose flour"""", """"1 teaspoon almond extract"""", """"1 teaspoon baking soda"""", """"\u00bc teaspoon salt"""", """"1 cup sweetened shredded coconut"""", """"1 (12 ounce) package miniature semisweet chocolate chips""""]"";""[""""Preheat the oven to 350 degrees F (175 degrees C)."""", """"Beat white sugar, butter, shortening, and brown sugar together in a bowl using an electric mixer until creamy. Add milk chocolate powder and mix until well blended. Beat in eggs."""", """"Gradually add flour, almond extract, baking soda, and salt to the butter mixture. Beat until well blended. Stir in coconut and fold in chocolate chips. Drop tablespoonfuls of dough onto ungreased baking sheets, spacing them 2 inches apart."""", """"Bake in the preheated oven until lightly browned on the edges, 10 to 12 minutes. Allow to cool for 2 minutes on the baking sheets. Transfer cookies to a cooling rack to cool completely.""""]"";12;4"
"Boursin Scrambled Eggs;Breakfast And Brunch;Breakfast And Brunch;These Boursin scrambled eggs, silky smooth with a subtle savory flavor, are what I like to make for breakfast or brunch when we have overnight friends or family visiting. We enjoy them served with sautéed mushrooms and sliced tomatoes on the side.;""[""""4 large eggs"""", """"3 tablespoons half-and-half"""", """"1 pinch salt"""", """"1 tablespoon unsalted butter"""", """"2 tablespoons garlic and fine herbs spreadable cheese (such as Boursin\u00ae)"""", """"ground black pepper"""", """"chopped fresh parsley or chives, for garnish""""]"";""[""""Whisk eggs, half-and-half, and a pinch of salt together in a small bowl."""", """"Melt butter in a medium nonstick pan over medium-low heat. When butter starts to bubble, pour in egg mixture. Using a silicone spatula, gently swirl the eggs around in circles from the outside in, without stopping, until you start to see small curds, about 20 to 30 seconds."""", """"Switch from making circles to making long sweeps across the pan until you see larger curds, about 20 seconds. When eggs are about 75% cooked, gently fold in crumbled cheese. The eggs now should be softly set and still a little runny in places."""", """"Remove the skillet from the heat, and set aside for about 20 to 35 seconds to allow the residual heat to finish cooking to your preferred consistency."""", """"Garnish with parsley or chives, and serve immediately.""""]"";7;5"
"Scotch Eggs;Breakfast And Brunch;Breakfast And Brunch;Scotch eggs are soft-boiled eggs wrapped in sausage and bread crumbs, deep-fried for a delicious savory treat. They're a British pub favorite, perfect for family occasions or picnics. We like to make these on Christmas Eve served on a bed of lettuce with sliced tomatoes and mustard for garnish.;""[""""1 quart oil for frying"""", """"4 large eggs"""", """"2 pounds bulk pork sausage"""", """"1 cup all-purpose flour"""", """"4 large eggs, beaten"""", """"4 cups dried bread crumbs, seasoned""""]"";""[""""Gather all ingredients. Preheat the oven to 350 degrees F (175 degrees C). Heat oil in a deep-fryer to 375 degrees F (190 degrees C)."""", """"Place eggs in a saucepan and cover with water. Bring to boil. Cover, remove from heat, and let eggs sit in hot water for 10 to 12 minutes. Remove from hot water, cool, and peel."""", """"Flatten sausage and make a patty to surround each egg."""", """"Very lightly flour the outer sausage layer then coat with beaten egg. Roll in bread crumbs to cover evenly."""", """"Deep-fry prepared eggs in hot oil until golden brown while making sure each side is well cooked."""", """"Bake in the preheated oven for 10 minutes."""", """"Cut in half and serve."""", """"Enjoy!""""]"";6;8"
"Crescent Breakfast Squares;Breakfast And Brunch;Breakfast Eggs;We love a savory breakfast, and these delicious breakfast squares fill the bill. Use ham and Swiss, or another deli meat and cheese combo, for a weekend breakfast or brunch. Prefer other veggies in your omelet? Substitute your faves!;""[""""2 12x16-inch parchment paper sheets"""", """"2 (12 ounce) packages crescent roll dough (such as Pillsbury\u00ae Grands!\u2122)"""", """"8 slices deli ham"""", """"2 tablespoons Dijon mustard, or more to taste"""", """"3 tablespoons unsalted butter, divided"""", """"\u00bd cup diced onion"""", """"\u00bd cup diced red bell pepper"""", """"10 large eggs"""", """"1 tablespoon half-and-half cream or heavy whipping cream"""", """"1 pinch salt and freshly ground black pepper to taste"""", """"8 slices Swiss cheese"""", """"1 tablespoon bagel seasoning (such as Trader Joe's\u00ae Everything But the Bagel Seasoning Blend)""""]"";""[""""Preheat oven to 375 degrees F (190 degrees C)."""", """"Spread each sheet of parchment on a work surface. Unroll crescent dough, and place the contents of one can on each sheet. Roll dough into two 10x15-inch rectangles, making sure the perforations are sealed, one rectangle per parchment."""", """"Slide one dough rectangle with its parchment paper onto a 13x18-inch sheet pan; reserve the second rectangle for later use."""", """"Working with the first piece of dough, spread ham slices over the dough, leaving about 1/2-inch on all sides. Spread Dijon mustard in a thin layer over the ham slices."""", """"Melt 1 tablespoon butter in a large skillet over medium heat; cook and stir onions and bell peppers until slightly softened, about 3 minutes."""", """"Reduce heat to medium low; add 1 tablespoon butter to skillet with vegetables until melted."""", """"Whisk eggs, half-and-half or cream, salt, and pepper together in a large bowl until well blended. Pour egg mixture into the skillet with vegetables. Cook, using a spatula to lift and move, until eggs are just set and still wet looking."""", """"Spoon lightly cooked egg mixture in an even layer over the ham slices, maintaining the 1/2-inch dough border all around. Place sliced Swiss cheese in a single layer over the eggs."""", """"Place the second dough rectangle over all, using the parchment to help you align it. Carefully peel off the parchment. Moisten fingertips and press the edges of the two dough rectangles together, then use a fork to crimp."""", """"Melt remaining 1 tablespoon butter; brush over the top of the dough with a pastry brush. Sprinkle bagel seasoning over all."""", """"Bake in the preheated oven until nicely browned, 20 to 25 minutes. Remove to cool on a wire rack for about 15 minutes. Slice into serving pieces with a sharp knife.""""]"";12;11"
"Buttermilk Pumpkin Waffles;Breakfast And Brunch;Waffles;Nothing beats the smell of freshly baked waffles on a cold wintery day.;""[""""1 cup all-purpose flour"""", """"1 teaspoon baking powder"""", """"\u00bd teaspoon baking soda"""", """"\u00bc teaspoon salt"""", """"\u00be teaspoon ground cinnamon"""", """"\u00bd teaspoon ground ginger"""", """"\u215b teaspoon ground nutmeg"""", """"2 teaspoons canola oil"""", """"1 teaspoon molasses"""", """"\u00bc cup canned pumpkin"""", """"1 cup buttermilk"""", """"1 large egg"""", """"2 tablespoons Splenda No Calorie Sweetener, Granulated"""", """"1 \u00bd cups maple syrup sweetened with Splenda Brand Sweetener""""]"";""[""""Preheat waffle iron according to manufacturer's directions; spray lightly with vegetable cooking spray."""", """"Combine flour, baking powder, soda, salt, cinnamon, ginger, and nutmeg in a large bowl. Set aside."""", """"Combine oil, molasses, pumpkin and buttermilk in a small bowl; set aside."""", """"Whisk together egg and Splenda Granulated Sweetener until blended. Add buttermilk mixture, whisking until blended. Add to dry ingredients, stirring just until moistened."""", """"Pour batter into a hot waffle iron and bake approximately 5 minutes*. Serve with maple syrup.""""]"";14;5"
"Banana Breakfast Cookies;Breakfast And Brunch;Breakfast Cookies;This is a variation of the Healthy Banana Cookies recipe from this site. They are a great alternative to store-bought granola bars!;""[""""3 very ripe bananas"""", """"2 cups rolled oats"""", """"1 cup raisins"""", """"\u2153 cup plain yogurt"""", """"1 teaspoon ground cinnamon""""]"";""[""""Preheat the oven to 350 degrees F (175 degrees C). Line cookie sheets with parchment paper."""", """"Mash bananas in a large bowl. Add oats, raisins, yogurt, and cinnamon. Mix well and allow to sit for 15 minutes."""", """"Drop spoonfuls of dough 2 inches apart onto the prepared cookie sheets."""", """"Bake in the preheated oven until lightly browned, about 20 minutes.""""]"";5;4"
"Oven-Baked Caramel French Toast;Breakfast And Brunch;French Toast;This oven-baked caramel French toast is perfect served with quiche, homemade home fries and fresh coffee! I make the bread for this recipe using my bread machine!;""[""""1 cup brown sugar"""", """"\u00bd cup unsalted butter"""", """"2 tablespoons light corn syrup"""", """"1 cup chopped pecans, divided"""", """"12 slices French or Italian-style bread"""", """"6 eggs"""", """"1 \u00bd cups milk"""", """"1 \u00bd teaspoons ground cinnamon"""", """"1 teaspoon vanilla extract"""", """"1 teaspoon ground nutmeg"""", """"\u00bc teaspoon salt""""]"";""[""""Combine 1 cup brown sugar, 1/2 cup butter and 2 tablespoons corn syrup in a small saucepan. Cook over medium heat, stirring constantly, until thickened."""", """"Pour sauce into a 9x13-inch baking dish; sprinkle with 1/2 cup pecans. Place 6 bread slices on top; sprinkle with remaining pecans and cover with remaining 6 bread slices."""", """"Combine eggs, milk, cinnamon, vanilla, nutmeg, and salt in a blender; blend until smooth. Pour egg mixture evenly over bread slices. Cover baking dish with plastic wrap; refrigerate 8 hours or overnight."""", """"Remove French toast from refrigerator 30 minutes prior to baking. Preheat the oven to 350 degrees F (175 degrees C)."""", """"Bake in the preheated oven until lightly brown, 40 to 45 minutes."""", """"Meanwhile, make the caramel sauce: Combine remaining 1/2 cup brown sugar, remaining 1/4 cup butter and remaining 1 tablespoon corn syrup; cook until thickened, stirring constantly."""", """"Drizzle sauce over French toast right before serving.""""]"";11;7"
"Mexican Hash;Breakfast And Brunch;Breakfast Sausage;This vibrant Mexican hash recipe is a hearty, eggless breakfast with minimal prep. It features spicy chorizo and crispy hash browns for a savory, satisfying start to the day. This can be served with a fried egg for those who want extra protein.;""[""""12 ounces uncooked chorizo sausage"""", """"\u00bc cup chopped onion"""", """"2 teaspoons vegetable oil"""", """"1 (16 ounce) package frozen diced hash brown potatoes"""", """"\u00bd teaspoon seasoning salt"""", """"1 (14.5 ounce) can Hunt's\u00ae Diced Tomatoes, drained"""", """"1 avocado, cubed"""", """"2 tablespoons coarsely chopped cilantro""""]"";""[""""Heat a skillet over medium-high heat. Cook and stir chorizo in the hot skillet until brown and crumbly, about 3 minutes. Add onion and cook, stirring frequently, until onion is translucent, about 3 minutes. Transfer chorizo-onion mixture to a plate."""", """"Pour oil into the same skillet over medium-high heat. Add frozen potatoes and seasoning salt; toss to coat potatoes in oil, then cook, stirring occasionally, until potatoes are browned and crispy, about 10 minutes."""", """"Add diced tomatoes and chorizo-onion mixture to the skillet; stir gently to mix evenly. Cook for 4 minutes, stirring once halfway. Serve topped with avocado and cilantro.""""]"";8;3"
"Cheesy Hash Browns;Breakfast And Brunch;Breakfast Potatoes;These cheesy hash browns are great for breakfast or a dinner side.;""[""""1 (2 pound) package frozen hash brown potatoes, thawed"""", """"1 (16 ounce) container sour cream"""", """"1 cup chopped onion"""", """"1 (10.75 ounce) can condensed cream of chicken soup"""", """"8 ounces shredded Colby cheese"""", """"5 \u2153 tablespoons butter, melted"""", """"salt and ground black pepper to taste"""", """"2 tablespoons crushed cornflakes cereal (Optional)""""]"";""[""""Preheat the oven to 375 degrees F (190 degrees C)."""", """"Mix together hash brown potatoes, sour cream, onion, cream of chicken soup, Colby cheese, and melted butter in a bowl until well combined; season with salt and black pepper. Transfer mixture to a 9x13-inch baking dish and sprinkle the top with cornflake crumbs."""", """"Bake in the preheated oven until casserole is bubbling, about 1 hour.""""]"";8;3"
"Bananas Foster Belgian Waffles;Breakfast And Brunch;Southern Breakfast And Brunch;As a special treat for my mother, I created this recipe, which includes one of her favorite desserts and one of her favorite breakfast items. This creation also goes great with French toast, so make this as a special treat to your mom or any mom. Also a nice way to impress anyone with a special breakfast. I hope you enjoy as much as my mom did.;""[""""1 \u2153 cups all-purpose flour"""", """"\u00be teaspoon baking soda"""", """"2 teaspoons white sugar"""", """"\u00bc teaspoon salt"""", """"3 eggs"""", """"1 \u00bd teaspoons vanilla extract"""", """"1 \u2153 cups milk"""", """"\u2153 cup melted butter"""", """"2 teaspoons baking powder"""", """"\u00bc cup butter"""", """"\u2154 cup brown sugar"""", """"2 teaspoons rum flavored extract"""", """"2 teaspoons vanilla extract"""", """"\u00bd teaspoon ground cinnamon"""", """"\u00bc cup whole pecans"""", """"\u00bd cup pancake syrup (i.e. Mrs. Butterworth's\u00ae)"""", """"3 bananas, cut into 1/2 inch slices"""", """"1 cup heavy cream"""", """"\u00bc teaspoon vanilla extract"""", """"1 tablespoon confectioners' sugar""""]"";""[""""Preheat a Belgium waffle iron. Whisk together the flour, baking soda, baking powder, white sugar, and salt in a bowl; set aside."""", """"Whisk together the eggs, 1 1/2 teaspoons vanilla extract, and milk in a bowl. Stir in the melted butter and flour mixture until a slightly lumpy batter forms. Cook the waffles in the preheated iron until steam stops coming out of the seam, about 2 minutes."""", """"Meanwhile, melt 1/4 cup of butter in a saucepan over medium heat. Stir in the brown sugar, rum extract, 2 teaspoons vanilla extract, and cinnamon. Bring to a simmer, the stir in the pecans and continue simmering for 1 minute. Stir in the pancake syrup and bananas, continue cooking until the bananas soften, about 4 minutes."""", """"Beat the heavy cream, 1/4 teaspoon of vanilla and confectioners' sugar with an electric mixer in a medium bowl until firm peaks form."""", """"Once waffles are done, spoon bananas Foster sauce over waffle and top with a dollop of whip cream.""""]"";20;5"
"Strawberry Banana Protein Shake;Breakfast And Brunch;Healthy Breakfast And Brunch;This strawberry banana protein shake is a healthy, versatile drink, perfect for a post-workout meal. It also makes a healthy alternative to an ice cream shake for the kids. The banana and strawberries can be substituted with kiwi, pineapple, pears, mango, blueberries, etc. Get creative and enjoy!;""[""""1 cup skim milk"""", """"1 scoop vanilla-flavored whey protein powder"""", """"2 cups ice"""", """"1 cup strawberries"""", """"1 large banana"""", """"1 tablespoon natural peanut butter""""]"";""[""""Layer milk, protein powder, ice, strawberries, banana, and peanut butter in a blender in this order; blend until creamy and smooth.""""]"";6;1"
"Bacon Oatmeal Breakfast Cookies With Maple Glaze;Breakfast And Brunch;Breakfast Cookies;This recipe for bacon oatmeal breakfast cookies with maple glaze combines all of the flavors that make up the perfect breakfast in one cookie!;""[""""8 ounces bacon"""", """"\u00bd cup butter, softened"""", """"\u00bd cup white sugar"""", """"\u00bd cup packed brown sugar"""", """"1 egg"""", """"\u00bd teaspoon vanilla extract"""", """"1 cup all-purpose flour"""", """"1 teaspoon ground cinnamon"""", """"\u00bd teaspoon baking soda"""", """"\u00bd teaspoon salt"""", """"1 \u00bd cups quick-cooking oats"""", """"\u215e cup confectioners' sugar"""", """"1 \u00bd tablespoons water, or as needed"""", """"1 \u00bd tablespoons real maple syrup""""]"";""[""""Cook bacon in a large, deep skillet over medium-high heat, turning occasionally, until evenly browned, about 10 minutes. Drain on a paper towel-lined plate. When cool, chop bacon; set aside."""", """"Beat butter, white sugar, and brown sugar together in a large bowl with an electric mixer on medium speed until fluffy, beat in egg and vanilla extract until thoroughly combined. Whisk flour, cinnamon, baking soda, and salt together in a separate bowl; stir into butter mixture. Gradually stir in bacon and oats, about \u2153 cup oats at a time. Cover dough with plastic wrap; refrigerate at least 1 hour."""", """"Preheat the oven to 375 degrees F (190 degrees C). Thoroughly grease baking sheets."""", """"Scoop about \u2153 cup dough per cookie and roll into balls; place at least 3 inches apart on the prepared baking sheets. Flatten balls slightly using a fork dipped in water."""", """"Bake in the preheated oven until golden brown with slightly browner edges, 10 to 12 minutes. Cool on baking sheets 3 to 5 minutes before transferring to wire racks to cool completely."""", """"Meanwhile, whisk confectioners' sugar, water, and maple syrup together in a bowl until smooth; let stand about 5 minutes to slightly thicken. Drizzle on tops of cookies; let stand to set before storing, about 20 minutes.""""]"";14;6"
"Turkey Breakfast Sausage;Breakfast And Brunch;Breakfast Sausage;Homemade turkey breakfast sausage is easy to make. You can use this recipe for chicken and pork as well.;""[""""2 pounds ground turkey"""", """"1 tablespoon brown sugar"""", """"2 teaspoons kosher salt"""", """"1 \u00bd teaspoons ground black pepper"""", """"1 \u00bd teaspoons ground sage"""", """"1 \u00bd teaspoons ground thyme"""", """"\u00bd teaspoon dried marjoram"""", """"\u00bd teaspoon red pepper flakes""""]"";""[""""Mix together turkey, brown sugar, salt, black pepper, sage, thyme, marjoram, and red pepper flakes in a bowl until well combined. Shape turkey mixture into patties."""", """"Working in batches, fry patties in a large skillet over medium-high heat until golden brown and no longer pink in the center, 6 to 8 minutes. An instant-read thermometer inserted into the center should read at least 165 degrees F (74 degrees C).""""]"";8;2"
"Egg-White Crepes;Breakfast And Brunch;Crepes And Blintzes;Crêpes made with whole wheat flour, skim milk, and egg whites, you'd never know they're more health-conscious than your basic crêpe from the taste.;""[""""\u00bd cup whole wheat flour"""", """"\u00bd cup skim milk"""", """"2 egg whites"""", """"1 tablespoon vegetable oil"""", """"1 pinch salt"""", """"\u00bd cup mixed frozen berries, thawed and drained"""", """"1 tablespoon confectioners' sugar for dusting""""]"";""[""""Whisk flour, milk, egg whites, oil, and salt together in a large bowl until smooth."""", """"Lightly coat a skillet with cooking spray and place over medium heat. Pour 1/4 cup batter into the skillet and immediately rotate the skillet in a circular motion to spread batter out to edges in a thin layer. Cook until the bottom is light brown, about 2 minutes."""", """"Flip cr\u00eape; place 2 tablespoons mixed berries in center of cr\u00eape and cook 2 minutes more. Fold cr\u00eape in half; transfer to a serving plate using a spatula. Dust with confectioners' sugar; serve. Repeat with remaining batter, berries, and confectioners' sugar.""""]"";7;3"
"Spinach Quiche with Chicken;Breakfast And Brunch;Breakfast Meat And Seafood;This chicken quiche recipe works very well. Add seasonings of your family's choice for more variety. Use ham, bacon, or whatever protein. This quiche needs flavor boosters, so use your spice cabinet. Easily make this a Tex-Mex dish with diced green chiles and a touch of cumin. You could also add crumbled, freshly cooked bacon for more flavor. I served this with sliced avocado and tomatoes for a perfect light dinner.;""[""""1 cup shredded Cheddar cheese"""", """"1 (9 inch) unbaked pastry shell"""", """"1 cup diced cooked chicken"""", """"1 cup chopped fresh spinach"""", """"\u00bd cup chopped sweet onion (such as Vidalia\u00ae)"""", """"3 large eggs"""", """"\u00be cup half-and-half"""", """"\u00bd cup mayonnaise"""", """"\u00bc teaspoon salt"""", """"\u215b teaspoon ground black pepper"""", """"1 pinch salt-free seasoning blend (such as Mrs. Dash), or to taste"""", """"1 pinch herbes de Provence, or to taste""""]"";""[""""Preheat the oven to 350 degrees F (175 degrees C)."""", """"Sprinkle 1/4 cup Cheddar cheese into pastry shell. Mix together chicken, spinach, remaining 3/4 cup Cheddar cheese, and onion in a medium bowl; transfer mixture to pastry shell."""", """"Whisk together eggs, half-and-half, mayonnaise, salt, black pepper, seasoning blend, and herbes de Provence in a second medium bowl until well combined; pour over chicken mixture."""", """"Bake in the preheated oven until a knife inserted into the center comes out clean, 35 to 40 minutes. Let stand for 15 minutes before slicing and serving.""""]"";12;4"
", """"2 cups soy milk"""""
